"Harrisburg-Carlisle, PA Metro Area",571013,3985,3649,10401,19551,19209,27735,27108,7062,6846,8822,179799,25420
"Harrison, AR Micro Area",45143,300,187,796,1382,1184,2123,1371,236,352,282,12555,25460
"Harrisonburg, VA Metro Area",133557,1546,2194,3329,4327,4007,5689,19615,1942,1082,1022,35213,25500
"Hartford-East Hartford-Middletown, CT Metro Area",1207677,9904,8786,26070,39263,38435,63809,80471,19308,17629,30801,378951,25540
"Hastings, NE Micro Area",31587,273,431,471,891,1027,1491,2447,243,101,186,9356,25580
"Hattiesburg, MS Metro Area",168177,1116,1571,4073,6116,5154,8434,11857,3007,825,1165,41324,25620
"Hays, KS Micro Area",28775,358,550,1052,1101,1005,1284,3557,472,155,118,8933,25700
"Heber, UT Micro Area",72811,422,583,1287,2055,2212,4879,2911,718,814,1563,21873,25720
"Helena, MT Micro Area",79722,657,433,1118,2195,2479,3787,3395,790,1100,1518,26164,25740
"Helena-West Helena, AR Micro Area",18606,43,226,422,419,418,1112,591,186,7,16,3833,25760
"Henderson, NC Micro Area",44479,136,244,1016,1457,1035,2651,1175,413,128,193,10260,25780
"Hereford, TX Micro Area",18736,180,184,311,657,576,1507,877,67,39,2,3775,25820
"Hermiston-Pendleton, OR Micro Area",88432,924,553,1791,3521,3049,5678,3320,520,215,420,22369,25840
"Hickory-Lenoir-Morganton, NC Metro Area",366678,2336,2043,6801,11523,10155,18636,14272,2052,1614,2496,98444,25860
"Hillsdale, MI Micro Area",45757,365,314,846,1293,1185,2264,2404,197,196,345,12351,25880
"Hilo, HI Micro Area",199459,831,852,3482,5875,5961,9301,7590,1874,1915,2100,52285,25900
"Hilton Head Island-Bluffton, SC Metro Area",214752,1778,1911,4172,6773,5812,9379,6997,1441,1925,3398,65490,25940
"Hinesville, GA Metro Area",80041,882,1034,2809,4622,3143,3950,4747,940,285,202,22905,25980
"Hobbs, NM Micro Area",70277,334,620,1532,2651,2905,4115,2146,380,139,525,14399,26020
"Holland, MI Micro Area",116143,613,616,2256,3357,3485,6282,3483,567,524,1192,32321,26090
"Homosassa Springs, FL Metro Area",145169,701,570,1896,3072,2949,5690,3643,583,786,1495,50488,26140
"Hood River, OR Micro Area",23209,53,276,476,680,740,1443,567,104,185,283,6890,26220
"Hope, AR Micro Area",30193,301,126,610,565,630,1865,881,123,80,68,6286,26260
"Hot Springs, AR Metro Area",98555,668,518,1399,2861,2678,4108,3672,403,490,854,28059,26300
"Houghton, MI Micro Area",38181,1191,801,1629,1157,1007,1835,5635,954,353,1131,10923,26340
"Houma-Thibodaux, LA Metro Area",210162,1434,1348,3568,7709,7512,10740,7629,1251,702,1111,51593,26380
"Houston-The Woodlands-Sugar Land, TX Metro Area",6884138,47488,45603,137433,260339,262628,409639,358798,84779,70170,202888,1843172,26420
"Hudson, NY Micro Area",60371,287,309,1106,1741,1532,2617,1508,350,517,604,19609,26460
"Huntingdon, PA Micro Area",45369,438,304,923,1722,1493,2078,2086,253,172,228,11898,26500
"Huntington, IN Micro Area",36359,245,199,787,1165,1109,1843,2061,192,204,223,10705,26540
"Huntington-Ashland, WV-KY-OH Metro Area",361832,2712,2473,6790,11106,10340,17382,17225,3855,1344,2609,95679,26580
"Huntsville, AL Metro Area",457003,2939,3490,8748,16411,15519,24714,28738,7268,10186,21696,144896,26620
"Huntsville, TX Micro Area",72321,1150,1255,3382,3233,3569,2181,11651,796,437,342,16658,26660
"Huron, SD Micro Area",20364,106,98,262,661,780,987,446,103,61,255,5636,26700
"Hutchinson, KS Micro Area",62765,453,535,1129,2075,2009,3432,2846,364,389,229,18613,26740
"Hutchinson, MN Micro Area",35832,169,187,728,1124,1134,2012,1282,147,207,403,11634,26780
"Idaho Falls, ID Metro Area",145507,1002,830,2683,4589,5090,9555,6152,1266,919,3403,40928,26820
"Indiana, PA Micro Area",85032,1392,1255,2277,2519,2270,3463,9327,957,478,536,22979,26860
"Indianapolis-Carmel-Anderson, IN Metro Area",2029472,12624,12074,40508,72253,69899,114763,88626,23525,21517,33187,605485,26900
"Indianola, MS Micro Area",26168,170,169,747,1529,1190,1272,975,96,41,52,4579,26940
"Iowa City, IA Metro Area",170677,2906,2544,6662,7253,6088,6905,24942,6692,2338,2986,58499,26980
"Iron Mountain, MI-WI Micro Area",29753,180,127,452,787,822,1524,945,350,154,628,9534,27020
"Ithaca, NY Metro Area",102642,2503,2344,4229,3480,3160,3437,21509,6614,1909,2775,34245,27060
"Jackson, MI Metro Area",158636,974,1397,3129,5641,4950,8357,8053,873,878,1832,45447,27100
"Jackson, MS Metro Area",597727,4580,3976,11726,21075,19811,32106,33134,8930,4177,5001,148298,27140
"Jackson, OH Micro Area",32450,169,105,610,1065,979,1593,857,261,92,230,8327,27160
"Jackson, TN Metro Area",178442,1282,1128,3554,5445,4907,9462,9748,1172,797,978,45985,27180
"Jackson, WY-ID Micro Area",34706,138,209,594,1446,1636,1359,1298,812,492,595,11260,27220
"Jacksonville, FL Metro Area",1503574,9439,9717,28541,56050,52334,75152,77944,16651,17986,21364,451164,27260
"Jacksonville, IL Micro Area",39252,452,523,702,1288,1183,1749,2533,209,120,114,10759,27300
"Jacksonville, NC Metro Area",195069,5954,6078,13081,11793,8270,8186,12161,2726,1101,1124,53230,27340
"Jacksonville, TX Micro Area",52118,263,431,1164,1633,1503,3034,2199,298,193,213,11251,27380
"Jamestown, ND Micro Area",20965,197,181,467,680,788,896,1154,74,45,135,6650,27420
"Jamestown-Dunkirk-Fredonia, NY Micro Area",128496,826,1094,2517,4008,3725,6034,7279,778,717,750,38980,27460
"Janesville-Beloit, WI Metro Area",162152,1303,869,2964,4864,4934,9250,7344,1095,724,1316,49060,27500
"Jasper, AL Micro Area",64110,379,474,1072,2029,1817,3120,2205,284,113,234,15115,27530
"Jasper, IN Micro Area",54921,348,213,1033,1471,1633,3078,1693,274,173,569,15715,27540
"Jayuya, PR Micro Area",14539,116,199,258,545,434,831,731,95,61,43,1791,27580
"Jefferson, GA Micro Area",67885,308,313,1050,2180,2130,3852,2696,406,560,476,17574,27600
"Jefferson City, MO Metro Area",151273,1080,1024,3127,5386,5556,7964,7237,1154,1459,1254,41632,27620
"Jennings, LA Micro Area",31441,265,169,494,1026,924,1920,1025,157,77,50,6784,27660
"Jesup, GA Micro Area",29788,220,33,591,1126,958,1685,981,105,99,129,6760,27700
"Johnson City, TN Metro Area",202049,1530,1895,4107,6825,5987,8722,12116,3096,1610,1876,59795,27740
"Johnstown, PA Metro Area",133009,1135,866,2371,3744,3413,6298,6870,1034,625,844,39273,27780
"Jonesboro, AR Metro Area",131241,882,802,3147,5218,4325,6490,8611,1989,809,703,35204,27860
"Joplin, MO Metro Area",178100,1223,1102,3675,5963,5642,9727,7870,1119,781,1293,46826,27900
"Juneau, AK Micro Area",32227,144,216,738,1297,1324,1527,1446,654,549,611,10814,27940
"Kahului-Wailuku-Lahaina, HI Metro Area",165979,881,674,2600,4876,5482,7450,5215,1335,1293,1832,43488,27980
"Aberdeen, SD Micro Area",42824,217,497,864,1536,1341,2188,2100,305,174,276,13481,10100
"Aberdeen, WA Micro Area",72779,540,444,1042,2352,2300,3274,2281,145,334,650,21557,10140
"Abilene, TX Metro Area",170669,1625,1699,5382,7310,6390,8622,11409,1748,727,1174,43430,10180
"Ada, OK Micro Area",38355,474,305,757,1542,1263,1920,2678,455,374,177,9353,10220
"Adrian, MI Micro Area",98381,630,897,1859,3083,2966,5390,4975,575,468,788,28605,10300
"Aguadilla-Isabela, PR Metro Area",301107,2213,1944,5969,9582,8243,14889,17650,2114,1507,1872,45264,10380
"Akron, OH Metro Area",703845,5305,4962,15718,24235,21079,35140,43624,10919,6360,11893,221349,10420
"Alamogordo, NM Micro Area",66137,316,616,2513,2937,2428,3188,2696,540,355,811,17314,10460
"Albany, GA Metro Area",148436,1570,774,2977,4839,4358,9171,10412,1611,854,523,36909,10500
"Albany-Lebanon, OR Metro Area",125048,802,695,2218,4348,4043,6247,4660,1215,647,1252,37320,10540
"Albany-Schenectady-Troy, NY Metro Area",880736,7420,7033,19946,29285,28179,42247,59852,13869,12321,19969,283993,10580
"Albemarle, NC Micro Area",61588,324,373,1174,2153,1748,3043,2796,372,418,295,16560,10620
"Albert Lea, MN Micro Area",30463,120,94,462,845,936,1576,860,215,98,141,9255,10660
"Albertville, AL Micro Area",95643,261,755,1909,3121,2866,5816,3491,507,442,1266,23122,10700
"Albuquerque, NM Metro Area",912108,6376,6297,17510,33497,32796,47608,53034,15056,7890,17942,267489,10740
"Alexander City, AL Micro Area",51298,299,210,1061,1312,1217,2146,1536,314,174,455,13122,10760
"Alexandria, LA Metro Area",153310,1088,1267,2853,5497,5364,8853,6437,1440,383,805,37085,10780
"Alexandria, MN Micro Area",37513,292,176,574,1131,1164,1595,1330,252,301,417,13258,10820
"Alice, TX Micro Area",52240,214,532,1196,1742,1659,3413,1745,277,214,202,9040,10860
"Allentown-Bethlehem-Easton, PA-NJ Metro Area",837610,6533,5322,15473,26529,25557,43752,43901,8782,7677,14611,250730,10900
"Alma, MI Micro Area",40916,414,332,1122,1700,1482,1880,2660,234,133,149,10497,10940
"Alpena, MI Micro Area",28520,142,106,480,798,752,1510,950,162,127,241,9123,10980
"Altoona, PA Metro Area",123157,656,628,2048,4200,3566,5944,4754,872,488,930,37439,11020
"Altus, OK Micro Area",25063,156,222,713,1070,954,1334,1036,275,173,294,6852,11060
"Amarillo, TX Metro Area",263776,2115,1879,5066,9857,9984,14224,14561,2900,1472,2405,70975,11100
"Americus, GA Micro Area",35285,287,482,725,1180,1055,1892,3328,398,107,155,8258,11140
"Ames, IA Metro Area",123311,2631,3891,6813,4841,3795,4447,27171,4833,1501,2844,42113,11180
"Amsterdam, NY Micro Area",49302,309,220,964,1555,1543,2736,1525,488,346,296,13557,11220
"Anchorage, AK Metro Area",398900,3077,3261,10194,17916,16612,22205,20921,5375,2687,6961,117039,11260
"Andrews, TX Micro Area",18036,91,102,445,708,731,1283,406,38,11,16,3993,11380
"Angola, IN Micro Area",34453,358,388,732,979,883,1932,1867,161,210,402,10837,11420
"Ann Arbor, MI Metro Area",367000,5856,5685,13030,15171,12091,17695,50269,17884,7012,17507,123138,11460
"Anniston-Oxford, AL Metro Area",114618,929,793,1991,3965,3424,5392,6324,901,381,598,30258,11500
"Appleton, WI Metro Area",235628,1349,1468,4613,7598,7834,13591,10627,1687,1844,3224,76516,11540
"Arcadia, FL Micro Area",36903,399,189,859,1668,1721,1929,771,71,64,129,6551,11580
"Ardmore, OK Micro Area",58382,433,326,940,1893,1854,3330,1972,841,175,242,13756,11620
"Arecibo, PR Metro Area",180567,1485,1473,3409,6043,4896,8688,11006,1759,654,1182,27762,11640
"Arkadelphia, AR Micro Area",22386,571,501,483,608,523,805,3895,192,117,57,5331,11660
"Asheville, NC Metro Area",454351,2095,2142,7837,13681,13625,20408,19826,3704,3973,6058,143443,11700
"Ashland, OH Micro Area",53536,333,516,1071,1472,1456,2568,3357,411,144,294,14595,11740
"Ashtabula, OH Micro Area",97830,827,578,1518,3087,2907,5032,2597,659,274,401,25339,11780
"Astoria, OR Micro Area",39102,329,243,596,1171,1242,1811,1524,245,226,300,12767,11820
"Atchison, KS Micro Area",16268,317,163,252,385,398,765,2003,62,43,74,4130,11860
"Athens, OH Micro Area",65917,1743,2245,2264,2356,1940,2361,16900,2127,455,650,16996,11900
"Athens, TN Micro Area",53053,273,371,917,1504,1610,2937,1787,155,242,554,12952,11940
"Athens, TX Micro Area",81070,636,402,1271,2276,2099,4246,2741,272,303,563,20547,11980
"Baton Rouge, LA Metro Area",854318,7484,6949,20405,31671,30163,45116,53319,11094,6028,11788,224373,12940
"Battle Creek, MI Metro Area",134212,934,1074,2385,4228,3782,7241,6412,818,538,1133,37570,12980
"Athens-Clarke County, GA Metro Area",208457,3530,2776,7449,7864,6554,9434,29517,7693,1868,2300,62028,12020
"Atlanta-Sandy Springs-Alpharetta, GA Metro Area",5862424,40277,37820,113380,206602,195952,348230,305971,86159,96949,124962,1748923,12060
"Atlantic City-Hammonton, NJ Metro Area",266105,1944,1813,5079,8439,7538,13951,14939,2882,2415,3086,77905,12100
"Atmore, AL Micro Area",37057,332,211,616,1419,1394,1970,1020,151,112,86,6062,12120
"Auburn, IN Micro Area",42927,207,183,992,1408,1265,2467,1513,285,188,412,12547,12140
"Auburn, NY Micro Area",77425,579,547,1367,2711,2519,4052,3227,468,422,726,23262,12180
"Auburn-Opelika, AL Metro Area",161152,3340,2510,5633,6404,5116,7430,23772,4987,1284,2861,47982,12220
"Augusta-Richmond County, GA-SC Metro Area",599616,4765,3550,12493,22138,19629,32656,28218,6312,4515,8598,152852,12260
"Augusta-Waterville, ME Micro Area",121753,777,778,2112,3460,3549,5892,6086,1128,1179,1453,40976,12300
"Austin, MN Micro Area",39807,246,245,627,1249,1195,2365,1160,215,187,195,11185,12380
"Austin-Round Rock-Georgetown, TX Metro Area",2114441,15862,15195,42978,94197,95098,107160,132087,32629,42864,70983,655558,12420
"Bainbridge, GA Micro Area",26682,100,234,540,919,793,1362,687,49,64,22,5004,12460
"Bakersfield, CA Metro Area",887641,7757,7173,21173,38928,35258,60831,49134,6818,3230,7599,189199,12540
"Baltimore-Columbia-Towson, MD Metro Area",2796733,19144,17828,53579,100921,97498,138892,160747,55120,57242,63749,858549,12580
"Bangor, ME Metro Area",151774,1221,1306,3164,5429,4804,6962,12397,2376,682,1776,48408,12620
"Baraboo, WI Micro Area",63922,450,382,967,1825,1994,3228,1696,335,379,535,19943,12660
"Bardstown, KY Micro Area",45650,219,338,859,1449,1273,2599,1100,346,313,266,12943,12680
"Barnstable Town, MA Metro Area",213496,1078,804,4118,5091,4549,9109,7565,1846,2227,4388,80578,12700
"Barre, VT Micro Area",58350,486,559,1047,1582,1617,2924,3635,584,546,1063,20050,12740
"Bartlesville, OK Micro Area",51886,250,307,919,1640,1639,2808,1797,262,722,820,14941,12780
"Batavia, NY Micro Area",57808,286,292,1133,2168,1899,2832,2073,368,304,512,17972,12860
"Batesville, AR Micro Area",54566,377,326,960,1374,1575,2843,2064,418,152,171,13444,12900
"Bay City, MI Metro Area",104104,659,489,2003,3367,2993,5364,4734,539,315,1044,32262,13020
"Bay City, TX Micro Area",36774,267,52,830,1192,1040,1938,1266,160,145,356,8592,13060
"Beatrice, NE Micro Area",21594,79,111,392,524,588,1205,507,202,11,164,6681,13100
"Beaumont-Port Arthur, TX Metro Area",395174,2798,2836,8099,14951,14511,20266,16749,2889,1452,5033,97728,13140
"Beaver Dam, WI Micro Area",87715,512,437,1686,3075,3141,4768,2767,406,372,712,26813,13180
"Beckley, WV Metro Area",118828,567,883,2145,3636,3472,5072,4055,618,453,667,31734,13220
"Bedford, IN Micro Area",45548,213,298,770,1367,1245,2115,1530,313,125,578,12910,13260
"Beeville, TX Micro Area",32611,497,302,1260,1876,2003,1698,1823,87,35,96,5069,13300
"Bellefontaine, OH Micro Area",45316,170,304,804,1247,1205,2382,1028,246,118,464,13871,13340
"Bellingham, WA Metro Area",220821,2335,3031,6370,8233,7048,9736,21808,2313,1511,3164,74098,13380
"Bemidji, MN Micro Area",46403,510,577,1193,1545,1436,2275,3805,649,215,235,13175,13420
"Bend, OR Metro Area",186251,737,769,3153,5917,6223,8539,6791,1349,1417,2804,65349,13460
"Bennettsville, SC Micro Area",26753,162,109,638,1175,1211,1616,614,100,42,111,4707,13500
"Bennington, VT Micro Area",35746,185,281,770,912,819,1714,1899,356,190,428,11720,13540
"Berlin, NH Micro Area",31741,198,135,637,1087,974,1403,1044,147,141,267,10378,13620
"Big Rapids, MI Micro Area",43251,1052,598,1462,1331,1031,1911,6559,555,188,354,11625,13660
"Big Spring, TX Micro Area",36349,338,216,887,1622,1572,2079,1109,180,84,87,7315,13700
"Oshkosh-Neenah, WI Metro Area",170411,1242,1671,4663,6168,5851,8297,12742,1483,1245,2106,56129,36780
"Oskaloosa, IA Micro Area",22164,240,114,299,731,633,1169,1076,195,89,128,6280,36820
"Othello, WA Micro Area",19594,147,108,520,630,678,1316,381,45,25,53,3575,36830
"Ottawa, IL Micro Area",148580,1009,777,2725,4731,4524,7816,5132,626,517,1238,44666,36837
"Ottawa, KS Micro Area",25558,159,144,445,718,741,1387,1072,251,125,150,7055,36840
"Ottumwa, IA Micro Area",35141,219,204,823,1069,1075,1733,1551,240,88,173,9878,36900
"Owatonna, MN Micro Area",36683,220,284,645,956,1210,2133,1110,173,304,190,11289,36940
"Owensboro, KY Metro Area",118477,725,614,2195,3668,3355,6505,4260,933,480,835,33160,36980
"Oak Harbor, WA Micro Area",82866,399,796,2164,3467,2655,3037,3308,802,602,1888,30644,36020
"Ocala, FL Metro Area",353526,2008,1715,5270,9873,8775,15621,12138,2162,1755,4078,105621,36100
"Ocean City, NJ Metro Area",93086,831,496,1579,2663,2088,3975,3077,782,752,1028,32632,36140
"Odessa, TX Metro Area",160579,1292,1312,3768,7580,6792,9542,7175,1228,670,1173,34382,36220
"Ogden-Clearfield, UT Metro Area",662875,5023,5133,13080,23867,23883,44143,36353,6591,6848,10214,181246,36260
"Ogdensburg-Massena, NY Micro Area",108913,1410,1198,2232,3601,3309,4668,11161,1319,676,1145,30730,36300
"Oil City, PA Micro Area",51818,326,344,758,1381,1319,2254,1068,213,218,292,15506,36340
"Okeechobee, FL Micro Area",41144,353,126,755,1554,1354,1996,1017,125,35,124,8868,36380
"Oklahoma City, OK Metro Area",1382841,10552,11291,30137,52244,51472,71492,82046,19982,11174,16616,390278,36420
"Olean, NY Micro Area",77121,586,529,1387,2092,2147,4109,3483,367,332,552,21526,36460
"Olympia-Lacey-Tumwater, WA Metro Area",279711,1773,1735,5053,10293,9996,13704,14083,3081,3376,3923,94312,36500
"Omaha-Council Bluffs, NE-IA Metro Area",931779,5600,6111,18227,33514,34245,52610,46383,16135,11136,10921,290656,36540
"Oxford, MS Micro Area",53590,1538,1143,1443,2106,1754,1945,11325,1513,477,534,14961,37060
"Oxnard-Thousand Oaks-Ventura, CA Metro Area",847263,6440,5858,17438,30386,28134,49380,53022,8075,9213,17918,227509,37100
"Ozark, AL Micro Area",49277,284,233,1290,1984,1670,2593,2077,269,297,272,12722,37120
"Paducah, KY-IL Micro Area",96754,665,396,1560,2659,2616,5042,3177,543,356,957,28355,37140
"Pahrump, NV Micro Area",44380,397,170,552,1107,996,1690,838,115,209,503,13667,37220
"Palatka, FL Micro Area",73252,308,423,1371,2232,1808,3662,2222,443,318,391,18524,37260
"Palestine, TX Micro Area",57810,481,317,1325,3206,3274,3385,2787,228,177,163,10502,37300
"Palm Bay-Melbourne-Titusville, FL Metro Area",585507,3805,3095,9591,17467,15770,27602,27018,6527,7875,19761,193988,37340
"Pampa, TX Micro Area",23215,135,101,519,730,963,1131,479,166,79,120,5242,37420
"Panama City, FL Metro Area",182161,1305,1357,3343,6866,6460,8538,8200,1481,1405,3026,55542,37460
"Paragould, AR Micro Area",44937,298,503,710,1528,1348,2378,1586,468,151,130,11098,37500
"Paris, TN Micro Area",32284,180,159,481,893,739,1499,851,145,77,111,8882,37540
"Paris, TX Micro Area",49611,397,302,742,1680,1230,2683,1988,239,200,329,12091,37580
"Parkersburg-Vienna, WV Metro Area",90758,635,377,1359,2620,2407,4507,2661,739,416,970,27164,37620
"Parsons, KS Micro Area",20119,176,153,295,657,578,1047,523,58,47,87,5711,37660
"Payson, AZ Micro Area",53546,354,117,922,1368,1296,2256,1505,185,174,559,14463,37740
"Pearsall, TX Micro Area",19871,214,480,770,1552,1199,1564,770,51,9,19,2305,37770
"Pecos, TX Micro Area",15590,128,121,376,763,855,723,373,112,100,11,2114,37780
"Pella, IA Micro Area",33172,306,481,403,986,881,1746,1947,207,242,454,9703,37800
"Pensacola-Ferry Pass-Brent, FL Metro Area",488246,3840,3710,12223,19217,16681,23932,29378,5385,4469,6821,149743,37860
"Peoria, IL Metro Area",406883,2503,2479,7069,13198,13027,21001,19145,3516,3518,8146,119166,37900
"Peru, IN Micro Area",35815,294,215,841,1331,1456,2290,1547,116,145,119,9447,37940
"Philadelphia-Camden-Wilmington, PA-NJ-DE-MD Metro Area",6079130,38598,39490,119611,221482,207083,311563,327481,103705,80302,122304,1812670,37980
"Phoenix-Mesa-Chandler, AZ Metro Area",4761603,33181,32566,96768,182561,170701,263723,249820,58084,49942,89310,1391667,38060
"Picayune, MS Micro Area",55219,540,350,851,1875,1364,3008,2590,338,264,436,14826,38100
"Pierre, SD Micro Area",20625,31,66,285,676,670,987,218,68,240,290,6692,38180
"Pine Bluff, AR Metro Area",90865,816,699,2032,3668,3386,5098,4591,547,356,211,19129,38220
"Pinehurst-Southern Pines, NC Micro Area",97294,386,630,1204,2437,2874,4746,4146,714,872,1861,30965,38240
"Pittsburg, KS Micro Area",38968,533,683,1693,1248,1134,1749,4701,927,134,129,11410,38260
"Pittsburgh, PA Metro Area",2331447,12764,13878,43462,80785,77426,105033,110069,33695,31698,50894,772256,38300
"Pittsfield, MA Metro Area",126425,999,975,2234,3428,3333,5490,7640,1140,1175,1735,43102,38340
"Plainview, TX Micro Area",33826,351,420,734,1335,1253,2428,1478,109,48,181,6581,38380
"Platteville, WI Micro Area",51733,915,1004,1659,1565,1364,2529,6720,227,395,517,14703,38420
"Plattsburgh, NY Micro Area",80583,856,626,2445,3089,2842,3328,5904,531,450,422,24285,38460
"Plymouth, IN Micro Area",46461,326,152,992,1370,1187,2536,1386,274,195,370,11986,38500
"Pocatello, ID Metro Area",93436,615,914,1649,3697,3316,5480,6926,1521,395,1087,27084,38540
"Point Pleasant, WV-OH Micro Area",56908,379,378,850,1637,1494,2715,2010,299,203,294,14049,38580
"Ponca City, OK Micro Area",44402,291,246,901,1330,1355,2515,1563,143,264,336,11771,38620
"Ponce, PR Metro Area",226117,2056,1725,4780,7929,6318,12065,14781,2377,970,1540,36459,38660
"Pontiac, IL Micro Area",36040,185,313,602,1227,1202,1982,836,79,82,145,10497,38700
"Poplar Bluff, MO Micro Area",56223,274,313,986,1701,1738,2825,1853,254,117,140,13596,38740
"Portales, NM Micro Area",18888,146,365,742,709,606,964,2279,265,134,112,4938,38780
"Port Angeles, WA Micro Area",75392,457,328,1104,2099,2141,3037,2385,407,311,899,26304,38820
"Portland-South Portland, ME Metro Area",532075,2815,3021,9828,16795,16787,24958,24321,6910,5452,9244,184831,38860
"Portland-Vancouver-Hillsboro, OR-WA Metro Area",2445761,14072,14177,44343,93367,95500,121601,119203,32281,32888,60893,809947,38900
"Port Lavaca, TX Micro Area",21668,167,25,460,711,730,1148,632,38,103,359,5241,38920
"Port St. Lucie, FL Metro Area",472012,2604,2682,6920,13375,12339,22729,18992,4316,3106,7217,144660,38940
"Portsmouth, OH Micro Area",76040,512,482,1475,2717,2520,4034,3061,332,263,269,19795,39020
"Pottsville, PA Micro Area",142674,720,638,2686,4853,4599,7242,3593,907,531,841,42105,39060
"Poughkeepsie-Newburgh-Middletown, NY Metro Area",673839,6524,5747,14958,21057,19583,39393,43673,6859,7013,9905,191933,39100
"Prescott Valley-Prescott, AZ Metro Area",228067,1669,1383,2434,5535,5159,8328,12122,1478,1632,2906,80043,39150
"Price, UT Micro Area",20308,101,186,379,583,620,1161,1216,157,23,151,6097,39220
"Prineville, OR Micro Area",23011,40,54,409,606,548,1045,682,135,191,227,7627,39260
"Providence-Warwick, RI-MA Metro Area",1618268,12767,11223,33814,56991,52270,77556,106572,22204,16352,27069,484123,39300
"Provo-Orem, UT Metro Area",616791,5653,7788,26182,25699,19575,45578,70408,8281,8317,7053,155383,39340
"Pueblo, CO Metro Area",165982,1407,1104,2986,5491,5330,8919,8480,1330,1118,1085,45623,39380
"Pullman, WA Micro Area",49231,1643,1474,2886,2416,1475,1443,15553,2710,762,1114,15891,39420
"Punta Gorda, FL Metro Area",181067,898,1083,1841,3804,3243,6123,5796,670,1331,2936,61715,39460
"Quincy, IL-MO Micro Area",76040,402,317,1337,2399,2153,3633,3150,518,311,486,21520,39500
"Racine, WI Metro Area",195602,1249,1232,3904,5808,5846,11228,8163,1569,1149,2302,58405,39540
"Raleigh-Cary, NC Metro Area",1332311,9113,7744,24720,46487,46226,75478,74529,21208,32505,45939,426367,39580
"Rapid City, SD Metro Area",138402,1032,1290,2780,5003,4752,6564,7172,1710,1001,2076,43708,39660
"Raymondville, TX Micro Area",21588,270,297,766,1066,930,1555,816,32,6,38,3055,39700
"Reading, PA Metro Area",418025,3326,2830,8098,13539,12369,22191,22693,3964,2807,4720,116400,39740
"Red Bluff, CA Micro Area",63912,604,402,867,2093,1921,3848,2759,222,207,352,17185,39780
"Redding, CA Metro Area",179212,925,1157,3218,5997,5572,8792,8498,1931,780,1598,54675,39820
"Red Wing, MN Micro Area",46246,147,184,896,1332,1401,2571,1552,303,317,509,15021,39860
"Reno, NV Metro Area",460924,3408,3919,8139,18488,16958,23084,27984,5896,4269,8313,151641,39900
"Rexburg, ID Micro Area",52120,409,868,4096,2861,1375,3424,11596,544,311,477,13466,39940
"Richmond, IN Micro Area",66342,440,539,1237,1917,1896,3224,3212,371,145,318,18708,39980
"Rockford, IL Metro Area",338356,1728,1928,6688,10446,9983,19544,13149,3657,1643,4751,100224,40420
"Rockingham, NC Micro Area",44997,492,468,924,1381,1120,2407,1713,178,164,189,11294,40460
"Rockport, TX Micro Area",24462,287,80,375,431,541,1553,547,111,117,329,7399,40530
"Rock Springs, WY Micro Area",43521,250,213,910,1468,1674,2495,2204,354,229,598,12706,40540
"Rocky Mount, NC Metro Area",146678,802,1083,2693,4347,3746,7302,6375,1101,871,744,37425,40580
"Rolla, MO Micro Area",44630,788,770,1684,1435,1301,1768,5922,1357,285,983,13852,40620
"Rome, GA Metro Area",97369,523,688,1888,3370,2823,4957,5348,717,458,544,23825,40660
"Roseburg, OR Micro Area",109114,632,607,1581,2919,2973,4672,3254,516,370,946,34792,40700
"Roswell, NM Micro Area",65144,519,504,1183,2129,2074,3623,2831,207,177,336,15048,40740
"Ruidoso, NM Micro Area",19461,83,164,215,445,460,690,640,34,123,142,5629,40760
"Russellville, AR Micro Area",85225,975,849,1631,2922,2494,4229,6833,577,412,744,20255,40780
"Ruston, LA Micro Area",47246,856,913,2518,1629,1425,2291,8253,1407,276,620,12279,40820
"Rutland, VT Micro Area",58892,506,402,1009,1613,1576,2695,3298,638,284,501,19898,40860
"Sacramento-Roseville-Folsom, CA Metro Area",2315980,17172,15898,46272,85212,80882,124871,161290,29904,22903,44080,706838,40900
"Safford, AZ Micro Area",37996,389,372,890,1701,1618,2317,2063,188,98,169,7508,40940
"Saginaw, MI Metro Area",191821,1525,1052,4022,6476,5337,10405,11261,1401,936,2142,54770,40980
"Richmond, VA Metro Area",1269530,8255,8108,23887,45643,43655,65878,67516,19370,18663,22671,381243,40060
"Richmond-Berea, KY Micro Area",105026,1100,1570,3133,3574,3018,4756,12413,1479,792,634,28252,40080
"Rio Grande City-Roma, TX Micro Area",64078,715,667,1272,2379,2013,4603,3022,247,115,43,7656,40100
"Riverside-San Bernardino-Ontario, CA Metro Area",4560470,36062,33655,102629,177295,160521,290854,294814,51796,26852,43549,1081275,40140
"Riverton, WY Micro Area",39812,305,108,806,1136,1264,1916,1370,331,155,281,11033,40180
"Roanoke, VA Metro Area",313009,1898,1761,4902,9394,9502,14814,13517,2886,2216,4260,94612,40220
"Roanoke Rapids, NC Micro Area",71136,414,553,1135,2227,1811,3748,2395,246,225,333,16969,40260
"Rochelle, IL Micro Area",51025,261,257,861,1441,1419,3031,1685,529,224,372,16006,40300
"Rochester, MN Metro Area",217964,1119,1158,3640,6850,7637,11563,8379,3151,3907,4219,72782,40340
"Rochester, NY Metro Area",1072877,7782,8104,21214,37198,33806,53965,66784,15058,14324,21782,337619,40380
"St. Cloud, MN Metro Area",198581,2230,2142,5261,6869,6668,10446,17747,1922,1218,1228,59402,41060
"St. George, UT Metro Area",165811,1003,1350,2946,4923,4873,10048,8990,1261,1096,1670,48760,41100
"St. Joseph, MO-KS Metro Area",126173,1001,753,2755,4857,4824,6440,5784,1012,589,713,31870,41140
