NAME,B01001_001E,B01001_008E,B01001_009E,B01001_010E,B01001_011E,B01001_012E,B14001_007E,B14001_008E,B14001_009E,B15012_002E,B15012_007E,B28010_003E,metropolitan statistical area/micropolitan statistical area
"Big Stone Gap, VA Micro Area",42456,356,238,1035,1791,1490,2222,1982,274,235,98,10638,13720
"Billings, MT Metro Area",179071,774,904,3687,5856,5880,8739,6202,1667,790,2414,59378,13740
"Binghamton, NY Metro Area",241874,2593,2894,5923,7021,6628,11668,19329,4190,3018,5089,76819,13780
"Birmingham-Hoover, AL Metro Area",1085330,6687,6550,19721,37169,35364,56538,50427,14030,9728,15674,302414,13820
"Bismarck, ND Metro Area",127503,731,865,2573,4842,5133,5557,5512,1381,890,1522,43666,13900
"Blackfoot, ID Micro Area",45839,326,347,717,1300,1320,3045,1716,244,178,500,11748,13940
"Blacksburg-Christiansburg, VA Metro Area",166785,3791,3010,6450,6255,4826,6458,32437,5744,1673,4494,47939,13980
"Bloomington, IL Metro Area",172578,2396,3413,4779,5686,5520,8312,24079,2977,4159,2397,53593,14010
"Bloomington, IN Metro Area",167296,3597,3961,6862,6951,5317,6134,32264,8126,2347,2638,51910,14020
"Bloomsburg-Berwick, PA Metro Area",83974,793,851,1974,2447,2401,3508,7999,741,643,659,24333,14100
"Bluefield, WV-VA Micro Area",107910,875,543,1866,3283,3059,4817,4374,702,533,814,27841,14140
"Blytheville, AR Micro Area",42126,175,347,861,1534,1279,2655,1188,305,44,199,9631,14180
"Bogalusa, LA Micro Area",46435,245,397,736,1442,1245,2363,1367,197,112,53,9019,14220
"Boise City, ID Metro Area",710743,4669,4888,13548,24991,24618,42599,36353,7529,6998,12254,218696,14260
"Bonham, TX Micro Area",34537,288,346,654,1235,1373,2076,1271,128,90,188,8612,14300
"Boone, NC Micro Area",54925,1599,1455,2644,1796,1423,1846,14099,1317,676,442,17581,14380
"Borger, TX Micro Area",21344,279,107,304,565,728,1244,917,58,148,236,5018,14420
"Boston-Cambridge-Newton, MA-NH Metro Area",4832346,34833,34536,102856,188377,175147,237633,310365,114214,95233,160584,1542736,14460
"Boulder, CO Metro Area",322510,3986,4380,9327,13193,11053,15749,34834,8954,9352,16865,115749,14500
"Bowling Green, KY Metro Area",174498,1922,1775,5401,6162,5397,8611,15617,2337,991,1539,47582,14540
"Bozeman, MT Micro Area",108063,2037,1395,3923,5039,4342,4082,12209,2293,1348,2872,38895,14580
"Bradford, PA Micro Area",41401,230,286,888,1355,1421,2051,1723,206,141,268,12246,14620
"Brainerd, MN Micro Area",93485,338,489,1401,2450,2547,4514,2220,464,495,643,30375,14660
"Branson, MO Micro Area",55114,339,566,952,1517,1435,2679,2943,189,247,155,16962,14700
"Breckenridge, CO Micro Area",30649,277,40,803,1723,1482,1001,996,265,308,884,9431,14720
"Bremerton-Silverdale-Port Orchard, WA Metro Area",265882,2037,2598,8017,11256,9677,12389,11891,2386,2804,6546,91682,14740
"Brenham, TX Micro Area",35163,330,166,567,820,707,1895,2707,132,230,242,8360,14780
"Brevard, NC Micro Area",33775,161,275,600,695,789,1486,1259,156,209,517,10649,14820
"Bridgeport-Stamford-Norwalk, CT Metro Area",943926,5318,6192,19077,26746,27432,57499,51759,13667,15366,21660,287606,14860
"Brookhaven, MS Micro Area",34320,201,140,601,1012,951,2032,1253,88,77,242,7338,15020
"Brookings, OR Micro Area",22650,228,49,226,634,434,697,262,211,179,280,8168,15060
"Brookings, SD Micro Area",34601,777,873,1527,1577,1140,1315,7116,1095,435,557,10530,15100
"Brownsville, TN Micro Area",17623,51,66,290,445,456,1055,468,164,26,26,3787,15140
"Brownsville-Harlingen, TX Metro Area",421666,3953,3228,8940,13678,12056,29675,18312,2145,1403,2926,67921,15180
"Brownwood, TX Micro Area",37855,305,195,652,1168,1101,2046,1552,257,190,257,9735,15220
"Brunswick, GA Metro Area",117400,785,676,1824,3428,3118,6175,3516,830,484,824,32805,15260
"Bucyrus-Galion, OH Micro Area",41821,235,203,815,1228,1061,2111,1022,115,160,206,12347,15340
"Buffalo-Cheektowaga, NY Metro Area",1130175,7639,7971,21447,41669,37078,56415,62263,17436,9924,16088,357684,15380
"Burley, ID Micro Area",44395,282,233,924,1429,1325,3099,1256,160,81,159,11201,15420
"Burlington, IA-IL Micro Area",46195,191,194,820,1321,1197,2298,1350,247,156,416,14012,15460
"Burlington, NC Metro Area",163324,1183,1240,2632,4914,4665,9332,10839,1039,1281,1502,46626,15500
"Burlington-South Burlington, VT Metro Area",218784,2451,2681,5604,7934,7098,10322,19805,4311,3054,5183,74199,15540
"Butte-Silver Bow, MT Micro Area",34770,361,405,854,1115,969,1479,2550,395,321,876,10716,15580
"Cadillac, MI Micro Area",48284,248,153,973,1360,1422,2485,1189,127,128,408,13334,15620
"Calhoun, GA Micro Area",57202,254,603,867,1701,1843,3146,1915,240,274,356,14161,15660
"California-Lexington Park, MD Metro Area",112290,697,873,2322,4114,3814,6246,6793,2158,1751,5045,33852,15680
"Cambridge, MD Micro Area",32138,176,94,545,959,868,1639,863,374,234,266,9184,15700
"Cambridge, OH Micro Area",39111,230,141,773,1220,1180,1993,1458,226,139,242,10620,15740
"Camden, AR Micro Area",29022,167,377,471,656,842,1450,1026,90,67,258,6485,15780
"Campbellsville, KY Micro Area",36550,227,362,720,1201,1016,2063,2094,343,139,71,9101,15820
"Cañon City, CO Micro Area",47321,59,172,1131,2204,2762,2115,942,304,349,319,13496,15860
"Canton-Massillon, OH Metro Area",399736,2530,2595,7261,12057,11185,20528,18050,3064,2060,4380,121484,15940
"Cape Coral-Fort Myers, FL Metro Area",737468,4003,3980,10391,20686,19787,32327,28789,6349,5366,10852,226174,15980
"Cheyenne, WY Metro Area",98320,834,705,2224,3987,3835,4644,4364,1112,447,1401,32661,16940
"Chicago-Naperville-Elgin, IL-IN-WI Metro Area",9508605,61788,61912,194078,347249,338221,527812,490001,151731,134649,189477,2799434,16980
"Cape Girardeau, MO-IL Metro Area",96976,1133,821,2495,3006,2803,4533,8404,1090,607,673,25824,16020
"Carbondale-Marion, IL Metro Area",137573,1408,1824,3809,5298,4643,6104,12976,3178,633,1053,37274,16060
"Carlsbad-Artesia, NM Micro Area",57732,234,405,1278,2085,2179,3122,1399,287,105,441,14908,16100
"Carroll, IA Micro Area",20281,92,20,460,499,547,1083,497,165,92,65,6667,16140
"Carson City, NV Metro Area",54773,298,201,1207,1996,1905,2868,2398,417,319,846,17577,16180
"Casper, WY Metro Area",80333,610,437,1256,3193,3148,4016,4025,686,318,832,25572,16220
"Cedar City, UT Micro Area",51213,444,812,1737,1960,1578,3190,5585,498,246,340,14422,16260
"Cedar Rapids, IA Metro Area",270056,1672,1635,5521,9190,8820,13778,12712,2541,2856,5390,87571,16300
"Cedartown, GA Micro Area",41908,249,341,860,1356,1334,2108,1449,223,80,144,9449,16340
"Celina, OH Micro Area",40884,256,248,700,1252,1164,2467,1111,204,169,377,12663,16380
"Central City, KY Micro Area",30951,211,283,612,996,907,1824,944,198,48,122,7475,16420
"Centralia, IL Micro Area",37743,156,206,688,1205,1053,1666,1120,191,78,121,10819,16460
"Centralia, WA Micro Area",78145,389,253,1448,2474,2286,4069,2749,555,395,655,23372,16500
"Chambersburg-Waynesboro, PA Metro Area",154147,718,739,2712,4494,4514,8295,4994,1260,1072,1253,46372,16540
"Champaign-Urbana, IL Metro Area",226323,4441,4122,9870,9126,7510,9231,36643,11700,3404,4581,74132,16580
"Charleston, WV Metro Area",264113,1223,1506,4440,7958,7574,12087,8218,2371,1501,2501,74081,16620
"Charleston-Mattoon, IL Micro Area",62189,625,880,1883,2090,1959,2512,7076,1039,370,493,18356,16660
"Charleston-North Charleston, SC Metro Area",774508,5759,5806,14984,30748,29173,37741,38453,10450,7655,14208,229146,16700
"Charlotte-Concord-Gastonia, NC-SC Metro Area",2545560,14442,15958,46984,88847,85692,141569,120359,27150,34421,46469,762130,16740
"Charlottesville, VA Metro Area",215445,2148,1909,4166,7527,7036,9538,19886,6299,3008,4712,70218,16820
"Chattanooga, TN-GA Metro Area",556209,3847,2987,10176,19257,17857,25811,28339,4762,4006,9160,158275,16860
"Chico, CA Metro Area",225817,2876,2938,6791,8352,6798,10777,25767,2419,1433,1934,69751,17020
"Chillicothe, OH Micro Area",76948,389,484,1567,2843,2783,4467,2230,460,221,375,20691,17060
"Cincinnati, OH-KY-IN Metro Area",2201741,14956,15883,42645,75748,71248,119342,112781,27273,24538,42000,673670,17140
"Clarksburg, WV Micro Area",93332,504,319,1682,2869,2817,4262,2806,546,406,761,25513,17220
"Clarksdale, MS Micro Area",23255,165,190,404,719,592,1331,1377,251,47,32,4632,17260
"Clarksville, TN-KY Metro Area",299470,2731,3117,10328,15818,12052,15194,18175,4010,1665,2143,84306,17300
"Clearlake, CA Micro Area",64195,271,420,927,1835,1814,3401,2647,328,254,527,18786,17340
"Cleveland, MS Micro Area",31848,229,162,754,1126,977,1642,2637,379,119,95,6758,17380
"Cleveland, TN Metro Area",122563,937,926,2209,3936,3486,6128,7323,872,583,1384,33042,17420
"Cleveland-Elyria, OH Metro Area",2056898,12855,11926,39395,67185,61974,109703,100496,27947,18363,35182,650813,17460
"Clewiston, FL Micro Area",40732,263,327,1156,1491,1581,2226,1283,12,14,125,6318,17500
"Clinton, IA Micro Area",46909,184,298,698,1236,1296,2430,1486,345,110,325,14079,17540
"Clovis, NM Micro Area",49732,436,685,1709,2523,2133,2630,2883,620,183,262,12802,17580
"Coamo, PR Micro Area",38906,248,199,722,1192,1100,1844,1944,250,182,237,5165,17620
"Coco, PR Micro Area",28109,102,227,642,912,717,1731,1377,161,61,89,3893,17640
"Coeur d'Alene, ID Metro Area",157322,1267,565,2621,5004,4798,8248,5906,1023,961,1684,49863,17660
"Coffeyville, KS Micro Area",32521,332,280,679,933,969,1491,1537,214,136,294,9037,17700
"Coldwater, MI Micro Area",43513,199,259,702,1412,1394,2226,1088,184,124,303,11701,17740
"College Station-Bryan, TX Metro Area",258029,7944,5378,10989,11596,8701,11028,47611,11405,2327,6438,73492,17780
"Colorado Springs, CO Metro Area",723498,6179,6565,20386,31317,28012,38693,47262,10081,13595,15765,230832,17820
"Columbia, MO Metro Area",205369,3057,4042,6578,8528,7062,8735,28175,6861,2436,3606,66483,17860
"Columbia, SC Metro Area",824278,7527,7368,18464,29676,26167,43780,53210,12415,7539,10491,238154,17900
"Columbus, GA-AL Metro Area",319402,2994,2748,7531,13875,12106,16605,19278,4836,2668,2144,82091,17980
"Cullman, AL Micro Area",82853,638,514,1184,2751,2539,4155,2521,314,241,355,19324,18980
"Columbus, IN Metro Area",82481,534,500,1695,3308,2896,4518,2665,879,1242,4450,24391,18020
"Columbus, MS Micro Area",59150,283,276,1477,2132,1826,2966,2897,433,263,451,14586,18060
"Columbus, NE Micro Area",33174,184,180,599,1082,1036,1972,1088,300,59,442,9438,18100
"Columbus, OH Metro Area",2077761,14742,14492,39688,84197,77877,110187,117458,32284,27831,39644,637258,18140
"Concord, NH Micro Area",149917,1307,813,2991,4650,4625,7655,8395,1633,1727,2511,49211,18180
"Connersville, IN Micro Area",23194,130,217,378,682,545,1136,703,55,116,105,6609,18220
"Cookeville, TN Micro Area",111197,1216,1295,2917,3825,3029,4973,9020,939,588,1280,31924,18260
"Coos Bay, OR Micro Area",63686,386,301,779,1789,1706,2945,1704,493,229,638,20016,18300
"Cordele, GA Micro Area",22713,126,330,258,454,667,1237,1238,100,28,58,4590,18380
"Corinth, MS Micro Area",37090,177,201,782,1045,1221,1870,1256,266,95,148,8905,18420
"Cornelia, GA Micro Area",44626,422,215,839,1259,1232,2274,2288,242,122,275,10083,18460
"Corning, NY Micro Area",96422,728,468,1566,2809,2924,4988,2735,519,884,1750,29649,18500
"Corpus Christi, TX Metro Area",428548,3041,2874,9122,16104,15435,23772,21456,2889,1711,4102,101586,18580
"Corsicana, TX Micro Area",48995,500,265,846,1452,1216,2870,1782,280,105,164,11017,18620
"Cortland, NY Micro Area",47865,692,869,1093,1441,1264,2317,6256,579,296,426,13789,18660
"Corvallis, OR Metro Area",91107,1996,2046,4265,3682,2669,3808,17485,3898,1607,3928,32207,18700
"Coshocton, OH Micro Area",36585,169,169,602,1104,985,1814,899,252,48,160,9367,18740
"Craig, CO Micro Area",13127,27,105,211,716,391,564,257,97,33,102,3988,18780
"Crawfordsville, IN Micro Area",38287,473,408,570,1197,1073,2050,1442,202,183,171,11122,18820
"Crescent City, CA Micro Area",27495,191,86,521,1295,1233,1555,751,102,75,201,7434,18860
"Crestview-Fort Walton Beach-Destin, FL Metro Area",272056,2219,1993,5793,11453,10349,12393,11774,2725,3033,5670,85518,18880
"Crossville, TN Micro Area",59216,369,282,827,1676,1291,2211,1331,301,289,576,18874,18900
"Decatur, IN Micro Area",35376,249,193,675,1142,947,1779,696,192,104,243,8299,19540
"Defiance, OH Micro Area",38160,242,405,632,1082,1143,2061,1655,225,113,316,11434,19580
"Del Rio, TX Micro Area",48969,559,439,1306,2143,1817,3163,2146,364,291,380,9607,19620
"Deltona-Daytona Beach-Ormond Beach, FL Metro Area",646288,4380,4031,10100,19404,17365,29061,33165,5333,4173,7758,201767,19660
"Deming, NM Micro Area",24083,194,167,497,717,816,1100,553,126,31,124,4157,19700
"Denver-Aurora-Lakewood, CO Metro Area",2892066,15826,16373,54101,122184,125047,149987,125765,43907,47313,78244,955937,19740
"DeRidder, LA Micro Area",37043,367,348,558,1370,1380,2065,1149,171,92,150,9113,19760
"Des Moines-West Des Moines, IA Metro Area",680439,4128,3361,12866,24670,25609,37432,28564,8682,8115,7749,214440,19780
"Detroit-Warren-Dearborn, MI Metro Area",4317848,25894,25969,85586,152295,132070,237541,213369,52345,43763,129088,1308397,19820
"Dickinson, ND Micro Area",32003,227,107,704,1569,1408,1411,1304,132,149,294,9662,19860
"Dixon, IL Micro Area",34389,219,273,563,1301,1187,1788,1409,173,133,238,10267,19940
"Dodge City, KS Micro Area",34179,157,219,990,1385,1246,2188,1180,162,124,178,6955,19980
"Cullowhee, NC Micro Area",57198,799,758,1491,1646,1498,2270,7409,642,301,303,15280,19000
"Cumberland, MD-WV Metro Area",98612,981,1020,1999,3454,3304,4323,6936,753,588,697,26150,19060
"Dallas-Fort Worth-Arlington, TX Metro Area",7320663,48018,47483,147041,271070,267640,430087,366947,94482,109716,158200,2054644,19100
"Dalton, GA Metro Area",143961,1139,1084,2540,5150,4454,9070,5868,677,379,557,33082,19140
"Danville, IL Metro Area",77563,511,451,1444,2332,2381,4201,2556,351,164,248,20466,19180
"Danville, KY Micro Area",54448,626,387,980,1731,1539,2753,3196,354,349,267,13627,19220
"Danville, VA Micro Area",102326,711,504,1786,3025,2734,5227,3993,766,400,448,27876,19260
"Daphne-Fairhope-Foley, AL Metro Area",212830,1156,865,3524,6048,5802,10617,6724,1271,1105,4051,61722,19300
"Davenport-Moline-Rock Island, IA-IL Metro Area",381175,2982,2039,6422,11611,12183,19690,17362,3552,2899,5773,113737,19340
"Dayton, TN Micro Area",32719,158,198,749,1050,947,1680,1472,304,67,306,7641,19420
"Dayton-Kettering, OH Metro Area",803543,6923,5656,14996,27740,25221,40302,51473,12328,7378,17284,252173,19430
"Decatur, AL Metro Area",152271,641,1455,2190,4812,4626,7846,5240,955,923,2525,38892,19460
"Decatur, IL Metro Area",105528,655,568,1934,3167,2878,5236,4308,700,530,1001,31008,19500
"Dothan, AL Metro Area",148252,951,962,2195,4479,4327,7828,5553,1222,857,1078,36180,20020
"Douglas, GA Micro Area",51260,497,276,1094,2119,1776,3040,2083,376,107,139,9844,20060
"Dover, DE Metro Area",176699,1463,1247,3770,6450,5456,9115,11383,2392,1004,1270,50715,20100
"Dublin, GA Micro Area",63891,346,504,1175,2081,1652,3418,2059,410,184,212,13505,20140
"DuBois, PA Micro Area",79908,402,429,1676,2706,2683,3559,1791,303,209,508,21754,20180
"Dubuque, IA Metro Area",96982,602,1015,1767,3129,3201,4872,6211,1017,1038,1581,29038,20220
"Duluth, MN-WI Metro Area",289247,2872,2532,6362,8813,8785,12952,20498,3070,1953,3087,92079,20260
"Dumas, TX Micro Area",21399,294,83,562,756,706,1251,652,97,109,209,4168,20300
"Duncan, OK Micro Area",43647,234,323,539,1308,1263,2504,1185,176,124,332,10818,20340
"Durango, CO Micro Area",55617,292,277,1107,2103,1897,2517,3444,653,603,1009,17789,20420
"Durant, OK Micro Area",46457,386,381,794,1768,1552,2388,2813,454,285,83,11362,20460
"Durham-Chapel Hill, NC Metro Area",626695,5545,5481,12210,22822,21703,30554,46102,19494,11399,13197,199066,20500
"Dyersburg, TN Micro Area",37416,257,185,536,1151,973,2055,1206,105,90,245,9746,20540
"Eagle Pass, TX Micro Area",58174,544,879,1251,2229,1916,4614,1776,167,200,324,8611,20580
"Easton, MD Micro Area",37167,56,79,577,844,814,1888,1274,374,328,671,13824,20660
"East Stroudsburg, PA Metro Area",168032,1214,1207,3844,5211,4490,9911,9494,1574,1376,1520,46665,20700
"Eau Claire, WI Metro Area",167406,1770,2024,4026,5712,5971,7843,14224,1307,1355,1270,52714,20740
"Edwards, CO Micro Area",54681,461,199,691,2483,2440,2988,1780,313,643,726,14587,20780
"Effingham, IL Micro Area",34137,195,315,508,1224,1159,1792,1096,176,129,330,10192,20820
"El Campo, TX Micro Area",41577,305,359,808,1291,1243,2641,1550,130,95,129,8869,20900
"El Centro, CA Metro Area",180701,1176,2195,4076,7898,7143,13105,11560,1178,493,1346,30081,20940
"El Dorado, AR Micro Area",39449,190,312,613,1142,1171,2246,1390,307,279,317,9568,20980
"Elizabeth City, NC Micro Area",52944,493,321,809,1736,1728,2517,3273,245,410,458,14377,21020
"Elizabethtown-Fort Knox, KY Metro Area",150913,763,1116,3679,5204,4979,8326,7470,1573,1084,1053,43077,21060
"Elk City, OK Micro Area",22268,139,141,477,966,1105,1387,614,120,178,125,5395,21120
"Elkhart-Goshen, IN Metro Area",204558,1851,1237,3678,6732,6350,12056,6088,705,819,1200,51109,21140
"Elkins, WV Micro Area",28930,213,200,485,1060,920,1097,977,110,88,157,6937,21180
"Elko, NV Micro Area",54156,296,307,1093,2118,2082,3151,1658,426,170,556,15036,21220
"Ellensburg, WA Micro Area",45897,1117,889,1604,1668,1302,2000,8070,531,332,478,15751,21260
"Elmira, NY Metro Area",84895,680,536,1330,2945,2641,4260,3047,421,372,848,25847,21300
"El Paso, TX Metro Area",840477,7710,8468,22105,35322,29979,53329,62210,12139,5126,10262,186486,21340
"Emporia, KS Micro Area",35888,494,509,1098,1171,998,1825,4019,530,155,104,11120,21380
"Enid, OK Metro Area",61898,588,446,1383,2326,2203,3255,2379,502,111,515,16587,21420
"Enterprise, AL Micro Area",51662,319,203,968,1728,1660,2946,2058,464,307,400,13887,21460
"Erie, PA Metro Area",273835,1747,2049,5753,9569,8633,13380,15609,3740,1986,3285,81835,21500
"Escanaba, MI Micro Area",36026,208,175,438,967,908,1901,883,206,131,294,11214,21540
"Española, NM Micro Area",39159,425,187,517,1168,1067,1941,1351,179,257,307,6679,21580
"Forrest City, AR Micro Area",25900,78,213,466,1089,1132,1666,682,160,12,221,4349,22620
"Eufaula, AL-GA Micro Area",27650,315,135,526,1205,1229,1471,796,111,45,136,5238,21640
"Eugene-Springfield, OR Metro Area",373340,3103,3977,10755,13497,11548,17060,30201,4304,2566,3085,126596,21660
"Eureka-Arcata, CA Micro Area",135940,1210,979,4069,4895,4602,5625,12412,1532,926,1187,43045,21700
"Evanston, WY Micro Area",20479,47,154,359,521,665,1179,506,51,57,163,6104,21740
"Evansville, IN-KY Metro Area",314960,1756,1982,5968,10725,9810,15898,15184,2547,2063,3478,94057,21780
"Fairbanks, AK Metro Area",99072,1570,1201,4014,5750,4442,4234,7139,1847,588,1441,30054,21820
"Fairfield, IA Micro Area",18148,112,121,423,720,518,655,1317,511,375,251,5221,21840
"Fairmont, MN Micro Area",19852,120,161,261,566,591,899,409,57,104,145,6098,21860
"Fairmont, WV Micro Area",56355,312,493,1539,1659,1581,2555,3296,432,261,494,16081,21900
"Fallon, NV Micro Area",24259,146,221,410,820,940,1125,744,100,137,110,7929,21980
"Fort Morgan, CO Micro Area",28517,177,167,571,910,1039,1800,725,167,89,112,7651,22820
"Fort Payne, AL Micro Area",71310,604,479,1050,2226,2017,4086,2529,178,165,320,15754,22840
"Fort Polk South, LA Micro Area",49646,733,774,2025,2810,2081,2288,2397,584,252,233,12596,22860
"Fort Smith, AR-OK Metro Area",249777,1793,1656,4585,8157,7586,13432,9936,1482,1207,1643,62263,22900
"Fargo, ND-MN Metro Area",240421,2393,3071,7408,11119,9903,10757,23616,4242,2532,3053,82031,22020
"Faribault-Northfield, MN Micro Area",66185,1144,810,1607,1878,2279,3296,7552,429,426,596,17812,22060
"Farmington, MO Micro Area",66643,426,463,1628,3171,2801,3722,2213,582,92,240,17215,22100
"Farmington, NM Metro Area",126515,843,735,2332,4521,4340,7382,6232,1077,290,911,28831,22140
"Fayetteville, NC Metro Area",519101,5198,5777,15509,25130,20281,28253,37251,7830,3356,2755,144995,22180
"Fayetteville-Springdale-Rogers, AR Metro Area",514259,4551,4157,12117,19594,19183,27081,33355,6164,6421,7998,149482,22220
"Fergus Falls, MN Micro Area",58195,319,375,805,1388,1451,2753,1243,325,274,503,17941,22260
"Fernley, NV Micro Area",54380,236,204,798,1759,1708,2701,1519,160,345,363,16670,22280
"Findlay, OH Micro Area",75837,347,472,1593,2719,2537,3817,3706,1013,568,1476,25610,22300
"Fitzgerald, GA Micro Area",17033,95,139,280,364,362,1009,421,53,58,54,3516,22340
"Flagstaff, AZ Metro Area",141274,2190,2116,4671,5698,4461,6707,23660,2328,1053,1889,37356,22380
"Flint, MI Metro Area",407875,2702,2617,7661,12841,10962,23242,17852,3884,1958,4435,119067,22420
"Florence, SC Metro Area",205502,1305,1258,3582,6389,5735,10911,10261,1679,1022,1618,51239,22500
"Florence-Muscle Shoals, AL Metro Area",147327,1116,846,3363,4838,4199,6784,8599,988,907,1130,39376,22520
"Fond du Lac, WI Metro Area",102597,860,545,1797,2983,3086,5202,5212,557,399,967,32161,22540
"Forest City, NC Micro Area",66599,333,365,1000,1743,1729,3307,2234,325,183,542,17545,22580
"Fort Leonard Wood, MO Micro Area",52425,1435,903,2540,3010,2568,3375,4309,947,187,527,12040,22780
"Fort Madison-Keokuk, IA-IL-MO Micro Area",58989,362,448,858,1759,1617,2754,1677,224,145,316,16552,22800
"Fort Wayne, IN Metro Area",406305,2265,2846,8217,14208,13024,22756,18956,3456,3039,5553,122909,23060
"Frankfort, IN Micro Area",32273,134,250,525,976,976,1880,912,70,27,149,8029,23140
"Frankfort, KY Micro Area",72938,647,268,1404,2539,2104,3522,3105,786,817,614,21336,23180
"Fredericksburg, TX Micro Area",26459,81,65,449,527,506,1352,406,106,124,344,7944,23240
"Freeport, IL Micro Area",45093,255,282,699,1282,1134,1985,1500,239,245,320,14535,23300
"Fremont, NE Micro Area",36665,354,228,621,1103,1059,1862,1713,373,117,33,11236,23340
"Fremont, OH Micro Area",59029,404,262,906,1636,1737,3406,2069,367,139,360,17284,23380
"Fresno, CA Metro Area",984521,7845,7613,21381,40691,36453,61841,64060,9343,3644,6574,216994,23420
"Gadsden, AL Metro Area",102748,744,669,1752,3236,2779,5338,4020,530,353,538,24688,23460
"Gaffney, SC Micro Area",56895,360,500,826,1979,1568,3105,2304,444,227,325,12997,23500
"Gainesville, FL Metro Area",323799,5282,5171,11694,13120,10530,12295,45618,12645,2852,5991,96021,23540
"Gainesville, GA Metro Area",198667,1315,1539,3866,6855,6294,11658,9420,1447,1364,1979,50275,23580
"Gainesville, TX Micro Area",40041,176,274,868,1231,1113,2126,1663,149,240,355,10351,23620
"Galesburg, IL Micro Area",50508,515,537,822,1531,1532,2109,3309,286,264,260,13457,23660
"Gallup, NM Micro Area",72438,623,429,1553,2821,2436,4572,3041,450,174,264,8884,23700
"Garden City, KS Micro Area",40657,525,239,870,1495,1414,2538,1977,273,57,115,9166,23780
"Gardnerville Ranchos, NV Micro Area",48132,126,224,738,1091,1249,2143,1642,355,381,1095,17726,23820
"Georgetown, SC Micro Area",61952,231,247,1073,1518,1356,3112,2156,467,161,935,18672,23860
"Gettysburg, PA Metro Area",102470,766,783,1833,2936,2701,4955,5684,854,601,749,30257,23900
"Gillette, WY Micro Area",61930,430,400,996,2201,2511,2888,1667,442,169,603,18542,23940
"Glasgow, KY Micro Area",53920,340,241,1048,1589,1447,2721,1538,363,54,204,14030,23980
"Glens Falls, NY Metro Area",125892,644,902,2358,4105,3690,6199,3956,801,867,1355,39943,24020
"Glenwood Springs, CO Micro Area",76981,164,304,1641,2711,2966,3747,2445,496,558,1048,22496,24060
"Gloversville, NY Micro Area",53646,322,378,917,1708,1609,2557,1730,359,181,341,14637,24100
"Goldsboro, NC Metro Area",123603,1011,890,2947,4681,3789,6930,6711,1113,415,317,33516,24140
"Granbury, TX Micro Area",58318,301,287,806,1522,1508,2570,1494,317,419,743,17735,24180
"Grand Forks, ND-MN Metro Area",101745,1683,1797,3264,4815,3696,4102,11787,1752,576,961,33839,24220
"Grand Island, NE Metro Area",75480,438,444,1397,2383,2510,4521,1836,514,250,497,20382,24260
"Grand Junction, CO Metro Area",151218,905,1151,2733,5119,5233,7859,8469,1077,923,1618,49595,24300
"Grand Rapids, MN Micro Area",45141,171,277,650,1125,1148,2278,1597,197,162,493,14228,24330
"Grand Rapids-Kentwood, MI Metro Area",1062392,8682,8648,23111,40233,36686,59181,61266,10982,8966,15201,311479,24340
"Grants, NM Micro Area",26891,102,167,581,1100,994,1608,959,232,64,105,4988,24380
"Grants Pass, OR Metro Area",86251,547,408,1203,2309,2223,4021,3019,419,203,520,28136,24420
"Great Bend, KS Micro Area",26453,182,251,426,799,759,1530,833,199,93,214,7510,24460
"Great Falls, MT Metro Area",81625,767,697,1876,3165,2835,3667,3418,570,407,697,24948,24500
"Greeley, CO Metro Area",305345,2509,2054,5366,11780,12038,16707,17242,2868,2374,4160,85884,24540
"Green Bay, WI Metro Area",319401,2258,1851,6075,10489,10521,16609,16597,2550,2454,3883,101055,24580
"Greeneville, TN Micro Area",68834,519,554,1083,1902,1711,3449,2815,384,233,409,17118,24620
"Greensboro-High Point, NC Metro Area",762063,5799,5240,14248,25411,21980,40784,50983,7765,6843,9997,219697,24660
"Greensburg, IN Micro Area",26562,132,153,612,841,817,1542,666,132,146,287,7554,24700
"Greenville, MS Micro Area",46057,374,333,797,1410,1255,2770,2161,368,137,228,9807,24740
"Greenville, NC Metro Area",178433,2187,2326,6112,6575,5054,7761,25720,4480,1332,1229,50308,24780
"Greenville, OH Micro Area",51513,233,292,961,1377,1322,2998,1694,344,161,238,15536,24820
"Greenville-Anderson, SC Metro Area",895942,6900,6811,18125,30282,27484,44225,52496,10482,6545,18839,253195,24860
"Greenwood, MS Micro Area",39292,286,286,716,1266,1036,2410,2251,343,101,277,7710,24900
"Greenwood, SC Micro Area",70411,540,662,996,2046,1814,3348,4143,596,494,1156,17890,24940
"Grenada, MS Micro Area",21088,25,233,230,664,530,1246,609,251,120,92,4736,24980
"Guayama, PR Metro Area",75623,710,570,1601,2874,2273,4358,4234,569,239,203,8672,25020
"Gulfport-Biloxi, MS Metro Area",412115,2752,2918,8262,14078,12729,21823,20239,2921,3091,4142,110336,25060
"Guymon, OK Micro Area",20805,316,239,324,842,878,1333,966,71,73,80,3997,25100
"Hagerstown-Martinsburg, MD-WV Metro Area",283147,1667,1765,5120,9937,9183,14531,11401,2798,2246,2529,79834,25180
"Hailey, ID Micro Area",23421,151,101,350,612,638,1348,349,108,28,231,6895,25200
"Hammond, LA Metro Area",132057,1423,1028,2159,4817,4473,6112,8585,665,411,396,31510,25220
"Hanford-Corcoran, CA Metro Area",150691,1367,1770,4417,7942,7165,11718,8973,1031,379,857,30797,25260
"Hannibal, MO Micro Area",38842,167,328,675,1077,1054,1819,1744,206,73,215,10831,25300
