"St. Louis, MO-IL Metro Area",2805190,16715,17827,52050,94798,92802,145019,134485,41283,35661,48897,876220,41180
"St. Marys, GA Micro Area",53231,707,549,1815,2650,2014,2943,1608,788,195,455,14865,41220
"St. Marys, PA Micro Area",30340,179,102,598,766,798,1565,568,103,125,438,10533,41260
"Salem, OH Micro Area",103190,685,568,1705,3033,2971,4991,2903,422,516,473,29238,41400
"Salem, OR Metro Area",422678,3025,3092,9365,15034,14188,23965,22450,3406,2351,3561,118792,41420
"Salina, KS Micro Area",60523,697,574,747,1976,1846,3254,2831,484,331,518,17733,41460
"Salinas, CA Metro Area",433410,3974,3040,9322,16585,16699,26961,28049,4648,2770,4378,95248,41500
"Salisbury, MD-DE Metro Area",404417,2588,3525,7204,11639,10980,18341,23572,3451,2878,3822,122499,41540
"Salt Lake City, UT Metro Area",1201043,8538,8144,25816,51262,48719,73668,68222,17337,14110,19813,341352,41620
"San Angelo, TX Metro Area",120837,1390,1191,2844,5114,4745,6058,8200,1155,809,519,31908,41660
"San Antonio-New Braunfels, TX Metro Area",2468193,19196,18373,53717,96940,92956,140818,136563,31388,22967,29186,610943,41700
"San Diego-Chula Vista-Carlsbad, CA Metro Area",3316073,29802,29878,83294,149715,135581,166153,245624,52851,50801,94914,972224,41740
"Sandpoint, ID Micro Area",43611,232,115,629,959,1061,2255,1008,190,173,467,13371,41760
"Sandusky, OH Micro Area",74780,206,701,1288,2270,2069,3725,2703,635,265,593,24073,41780
"Sanford, NC Micro Area",60481,334,243,1128,1955,1771,3371,3129,356,332,532,16004,41820
"San Francisco-Oakland-Berkeley, CA Metro Area",4701332,25734,24771,85990,192499,196601,213284,278718,82321,139385,197711,1481757,41860
"San Germán, PR Metro Area",125324,717,990,2936,3372,3090,6201,7691,963,635,699,12110,41900
"San Jose-Sunnyvale-Santa Clara, CA Metro Area",1987846,12663,12418,40253,85409,84300,101672,125281,38939,94729,172557,590388,41940
"San Juan-Bayamón-Caguas, PR Metro Area",2100207,15592,16064,41284,70450,59001,106161,136679,26594,12642,23574,342873,41980
"Sayre, PA Micro Area",60963,313,356,951,1730,1707,2852,1418,461,359,457,18233,42380
"Scottsbluff, NE Micro Area",38015,295,105,741,1127,1109,2101,1242,295,107,310,11046,42420
"Scottsboro, AL Micro Area",51852,446,194,747,1561,1481,2536,1083,264,200,479,12545,42460
"Scottsburg, IN Micro Area",23759,29,261,503,732,653,1170,514,96,26,151,5486,42500
"Scranton--Wilkes-Barre, PA Metro Area",555642,4214,3822,9671,18864,17227,26693,27148,5547,3835,4988,162068,42540
"Searcy, AR Micro Area",78762,1017,762,1493,2280,2204,3869,5614,1116,347,260,18824,42620
"Seattle-Tacoma-Bellevue, WA Metro Area",3871323,24579,22305,79068,169221,166315,179291,193139,54162,96631,138930,1312412,42660
"Sebastian-Vero Beach, FL Metro Area",153989,539,964,2110,3669,3290,6426,4931,941,1029,2111,46350,42680
"Sebring-Avon Park, FL Metro Area",103437,674,627,1264,2547,2373,3538,2696,548,352,553,29289,42700
"Sedalia, MO Micro Area",42355,231,370,690,1383,1366,2298,1738,216,64,212,11735,42740
"Selinsgrove, PA Micro Area",40483,515,395,675,1157,1067,1867,2732,208,274,207,10557,42780
"Selma, AL Micro Area",39149,288,224,580,1074,1008,2202,1630,326,43,64,8714,42820
"Seneca, SC Micro Area",77528,447,433,1318,2385,2137,3297,3431,641,513,1539,22282,42860
"Seneca Falls, NY Micro Area",34390,120,177,925,1464,1342,1462,1095,431,109,342,10154,42900
"Sevierville, TN Micro Area",97068,682,631,1649,3332,2653,4510,2802,349,390,670,26765,42940
"Seymour, IN Micro Area",44025,229,200,782,1326,1397,2511,1173,271,121,595,11878,42980
"San Luis Obispo-Paso Robles, CA Metro Area",282165,4252,4373,7699,8899,8828,11303,34215,2655,2835,5660,91402,42020
"Santa Cruz-Watsonville, CA Metro Area",273962,3640,3132,6851,9445,8171,12842,32328,4659,4106,6251,81680,42100
"Santa Fe, NM Metro Area",149293,774,730,2467,4126,4371,6758,6110,1632,1388,2795,48660,42140
"Santa Isabel, PR Micro Area",21757,150,226,420,658,558,1268,1213,214,59,243,3196,42180
"Santa Maria-Santa Barbara, CA Metro Area",444829,5712,5614,13969,16982,14674,22567,51497,6322,4276,8334,120448,42200
"Santa Rosa-Petaluma, CA Metro Area",499772,3275,2753,8546,16942,16411,24452,31629,5145,3603,8150,163088,42220
"Sault Ste. Marie, MI Micro Area",37629,565,309,1134,1482,1357,1639,2316,238,189,248,10502,42300
"Savannah, GA Metro Area",386036,2919,3141,8377,15952,14452,19495,26932,7287,2625,5585,111541,42340
"Shawano, WI Micro Area",45462,193,210,845,1240,1157,2583,1099,231,92,171,12806,43020
"Shawnee, OK Micro Area",72154,584,414,1402,2160,2112,4234,4043,510,256,376,17069,43060
"Sheboygan, WI Metro Area",115178,800,672,2142,3491,3521,6220,4874,781,825,1670,37322,43100
"Shelby, NC Micro Area",97282,744,836,1584,2926,2320,5223,5172,678,268,486,22761,43140
"Shelbyville, TN Micro Area",48292,562,279,819,1660,1547,2543,1327,189,318,222,11101,43180
"Shelton, WA Micro Area",63804,433,438,1126,1999,1980,2950,1858,150,341,610,19307,43220
"Sheridan, WY Micro Area",30140,319,87,393,880,974,1279,1366,188,156,526,10614,43260
"Sherman-Denison, TX Metro Area",131014,913,919,2200,3821,3692,7270,6638,978,720,1143,34087,43300
"Show Low, AZ Micro Area",109270,652,602,2239,3708,3259,6804,3060,556,379,675,20757,43320
"Shreveport-Bossier City, LA Metro Area",399619,2590,2980,7534,14219,13783,20607,16185,3679,2046,2809,103809,43340
"Sidney, OH Micro Area",48749,347,262,909,1446,1375,3070,1411,338,250,533,13938,43380
"Sierra Vista-Douglas, AZ Metro Area",125867,1127,723,2424,4479,4150,6783,5334,989,1387,1457,38797,43420
"Sikeston, MO Micro Area",38633,266,203,679,1263,1119,1765,1197,266,114,78,9749,43460
"Silver City, NM Micro Area",27669,214,238,390,657,653,1233,1066,328,139,390,7945,43500
"Sioux City, IA-NE-SD Metro Area",143846,1218,1012,2779,4701,4841,7737,7144,1000,667,735,40117,43580
"Sioux Falls, SD Metro Area",259348,1543,1401,4946,9902,10391,12888,10277,2384,2447,2414,82773,43620
"Snyder, TX Micro Area",17096,185,62,248,661,680,1186,745,104,17,12,3789,43660
"Somerset, KY Micro Area",64350,223,488,1059,1964,1771,3385,2269,382,234,470,16666,43700
"Somerset, PA Micro Area",74361,398,397,1445,2475,2340,3367,1670,331,332,380,20050,43740
"Sonora, CA Micro Area",54045,342,219,1018,1959,1891,2249,2311,306,297,594,17861,43760
"South Bend-Mishawaka, IN-MI Metro Area",321739,2960,2264,6233,10633,9849,17246,20266,4818,2750,3863,91476,43780
"Spartanburg, SC Metro Area",307617,2087,2041,5881,10857,9460,16766,15194,3169,1899,4047,83352,43900
"Spearfish, SD Micro Area",25478,270,219,637,823,787,1002,2145,320,99,524,8954,43940
"Spencer, IA Micro Area",16211,29,91,321,456,472,906,392,32,13,43,5233,43980
"Spirit Lake, IA Micro Area",17127,60,13,339,412,485,692,519,133,123,223,6256,44020
"Spokane-Spokane Valley, WA Metro Area",550160,3913,4486,10449,21439,19134,26480,32599,6008,4308,6467,179119,44060
"Springfield, IL Metro Area",209167,1092,1235,3756,6251,6389,11141,8937,3055,2015,1882,67831,44100
"Springfield, MA Metro Area",699480,7054,7369,15576,22552,20987,35042,63332,10946,6219,8558,203027,44140
"Springfield, MO Metro Area",462434,4637,4206,11289,15908,14961,21903,35357,6050,2771,2287,141579,44180
"Springfield, OH Metro Area",134726,912,799,2477,3933,3674,7049,6156,842,693,1058,39893,44220
"Starkville, MS Micro Area",59280,1227,1549,3414,2528,1728,2321,13523,2240,467,1147,15476,44260
"State College, PA Metro Area",161960,4395,4418,6357,7430,5505,5323,32349,7254,2927,5406,49560,44300
"Statesboro, GA Micro Area",76120,2049,1817,2223,2998,2385,3179,15806,1369,851,492,20129,44340
"Staunton, VA Metro Area",121651,566,610,2225,4034,3899,5466,3711,1243,845,1448,35612,44420
"Steamboat Springs, CO Micro Area",25072,134,132,438,1004,1081,1486,995,225,227,560,8485,44460
"Stephenville, TX Micro Area",41841,547,886,1350,1484,1199,1944,6836,358,488,500,10304,44500
"Sterling, CO Micro Area",22380,332,218,480,882,927,1084,1347,79,103,61,6469,44540
"Sterling, IL Micro Area",56016,331,282,849,1668,1372,3023,1443,214,173,406,16898,44580
"Stevens Point, WI Micro Area",70632,1057,888,2305,2366,2102,3098,8039,689,990,678,23139,44620
"Stillwater, OK Micro Area",81815,2337,2415,4129,3485,2648,2983,17708,3284,606,1420,23872,44660
"Stockton, CA Metro Area",742603,5671,6062,14749,27498,25487,47738,40711,6096,4446,6561,169761,44700
"Storm Lake, IA Micro Area",20058,101,247,398,592,723,1206,1269,93,35,49,5440,44740
"Sturgis, MI Micro Area",60836,287,516,994,1923,1815,3327,1550,246,122,482,16452,44780
"Sulphur Springs, TX Micro Area",36486,140,274,680,1087,1069,2177,1163,217,236,226,8976,44860
"Summerville, GA Micro Area",24812,131,209,613,1100,722,1048,727,166,4,65,5280,44900
"Sumter, SC Metro Area",140714,1019,1262,3557,5130,4223,7313,6731,1132,575,528,37606,44940
"Sunbury, PA Micro Area",91761,372,495,1716,3101,2969,3990,1897,443,313,515,26291,44980
"Susanville, CA Micro Area",30818,418,337,1692,2898,2189,1573,1020,120,79,47,6552,45000
"Sweetwater, TX Micro Area",14904,42,45,376,359,373,793,272,55,74,69,3302,45020
"Syracuse, NY Metro Area",652416,5671,4792,12608,21506,20169,33007,47493,9103,5214,9413,201509,45060
"Tahlequah, OK Micro Area",48664,634,676,1522,1430,1484,2801,4407,473,138,197,10447,45140
"Talladega-Sylacauga, AL Micro Area",80387,680,456,1419,2579,2240,4337,3385,375,279,373,19016,45180
"Tallahassee, FL Metro Area",382197,6339,5409,12944,14915,11910,17539,51126,10879,4062,4064,118826,45220
"Tampa-St. Petersburg-Clearwater, FL Metro Area",3097859,18462,17901,52124,103874,98343,142659,156508,36559,32722,46664,982885,45300
"Taos, NM Micro Area",32786,5,364,727,531,821,1438,1443,224,128,359,8415,45340
"Taylorville, IL Micro Area",32931,112,320,556,1052,1066,1610,1097,119,90,221,10014,45380
"Terre Haute, IN Metro Area",186908,1820,1855,4581,6773,6027,8441,13229,1856,994,1473,50435,45460
"Texarkana, TX-AR Metro Area",149292,815,1008,3246,5362,4730,7715,5970,1014,761,1085,35540,45500
"The Dalles, OR Micro Area",26130,167,211,384,910,765,1242,827,138,57,280,7666,45520
"The Villages, FL Metro Area",125044,327,262,762,2084,2307,2465,1720,156,1442,3004,47826,45540
"Thomaston, GA Micro Area",26236,289,215,319,830,551,1551,838,306,88,91,6795,45580
"Thomasville, GA Micro Area",44630,244,120,963,1221,1307,2473,1704,618,167,307,12018,45620
"Tiffin, OH Micro Area",55351,405,483,1143,1737,1542,2990,3755,385,222,247,15910,45660
"Tifton, GA Micro Area",40541,460,318,642,1386,1173,2084,2966,94,187,120,9143,45700
"Toccoa, GA Micro Area",25750,148,108,544,794,705,1523,1445,114,151,100,6507,45740
"Toledo, OH Metro Area",644137,5484,5598,13010,22807,19777,32749,40305,9287,3124,8947,198374,45780
"Topeka, KS Metro Area",232778,1173,1211,4480,6785,6721,12376,8806,2068,1940,1744,70060,45820
"Torrington, CT Micro Area",182002,907,783,3437,4887,4694,9332,7441,1832,1825,3198,61772,45860
"Traverse City, MI Micro Area",149033,692,852,2324,4403,4491,6719,5996,1045,928,2404,48980,45900
"Trenton-Princeton, NJ Metro Area",367922,2686,3559,8020,12243,11296,19190,26068,6594,8156,10575,104062,45940
"Troy, AL Micro Area",33333,716,467,1579,1314,764,1250,5413,725,186,241,6769,45980
"Truckee-Grass Valley, CA Micro Area",99244,273,348,1620,2430,2542,4447,3968,650,748,2361,34998,46020
"Tucson, AZ Metro Area",1027207,10074,9771,26600,36299,31604,52269,74161,14173,9521,20396,319303,46060
"Tullahoma-Manchester, TN Micro Area",103312,770,575,2063,3067,2742,5351,4524,618,648,1598,27787,46100
"Tulsa, OK Metro Area",990544,6612,5823,19197,34648,33351,53618,43181,8692,5844,13815,281460,46140
"Tupelo, MS Micro Area",165407,1107,1012,3201,5335,4989,8716,7685,1317,625,920,36208,46180
"Tuscaloosa, AL Metro Area",250681,2801,3205,7420,9923,7726,11484,25623,3758,1228,2965,59807,46220
"Twin Falls, ID Metro Area",108599,568,538,2289,3609,3828,6419,4550,588,204,611,29415,46300
"Tyler, TX Metro Area",227449,1602,1539,4658,7835,7198,12328,12937,2145,1746,2442,50374,46340
"Ukiah, CA Micro Area",87224,551,421,1481,2477,2534,4344,4132,614,416,621,25727,46380
"Union, SC Micro Area",27490,151,143,471,808,616,1376,880,169,82,72,6338,46420
"Union City, TN Micro Area",30365,176,134,423,896,711,1745,881,145,99,129,7925,46460
"Urbana, OH Micro Area",38845,250,289,735,1171,1061,2066,1433,152,125,192,11415,46500
"Urban Honolulu, HI Metro Area",984821,8069,8769,24167,42375,37554,43728,60799,14230,9426,17242,256098,46520
"Utica-Rome, NY Metro Area",292016,2403,1916,5879,9334,9061,14317,15026,2492,2639,2945,85121,46540
"Uvalde, TX Micro Area",26920,174,465,376,992,847,1855,980,190,46,84,5466,46620
"Valdosta, GA Metro Area",145315,1680,1428,5091,6011,5109,7409,12191,1854,805,882,36499,46660
"Vallejo, CA Metro Area",441829,3171,2742,9865,17181,16042,23341,24636,4821,3070,5911,125880,46700
"Van Wert, OH Micro Area",28261,183,177,428,848,738,1536,887,221,87,184,8490,46780
"Vermillion, SD Micro Area",13957,307,315,737,535,315,423,3750,658,47,86,4512,46820
"Vernal, UT Micro Area",36084,178,239,809,1192,1553,2516,977,223,46,213,8307,46860
"Vernon, TX Micro Area",12833,78,58,125,376,493,611,462,155,1,23,3249,46900
"Vicksburg, MS Micro Area",46519,453,292,711,1433,1250,2485,1764,411,276,950,11607,46980
"Victoria, TX Metro Area",99674,653,897,1702,3551,3270,5718,3875,499,609,1314,22840,47020
"Vidalia, GA Micro Area",36030,250,318,576,1081,1042,2123,1513,201,77,177,7692,47080
"Vincennes, IN Micro Area",37065,505,251,973,1157,1130,1494,2867,232,176,131,10365,47180
"Vineland-Bridgeton, NJ Metro Area",151906,1066,787,2978,6265,6240,8527,5182,649,479,871,35968,47220
"Vineyard Haven, MA Micro Area",17312,29,77,185,420,495,830,490,80,187,127,5648,47240
"Virginia Beach-Norfolk-Newport News, VA-NC Metro Area",1761729,16280,16045,45623,73356,64863,85869,118142,29212,20431,28992,535346,47260
"Visalia, CA Metro Area",461898,3721,3489,9836,17242,16005,33422,25373,3459,1049,1662,90124,47300
"Wabash, IN Micro Area",31389,194,255,613,896,778,1575,1596,188,153,193,9158,47340
"Waco, TX Metro Area",268361,3016,3714,7237,8866,8292,14193,23995,3467,1373,1965,66858,47380
"Wahpeton, ND-MN Micro Area",22545,280,170,407,650,657,1146,1572,112,63,175,7438,47420
"Walla Walla, WA Metro Area",60365,654,599,1534,2309,2063,3074,5449,410,322,829,18509,47460
"Wapakoneta, OH Micro Area",45729,290,216,876,1377,1228,2572,1178,393,104,366,15123,47540
"Warner Robins, GA Metro Area",180652,1791,1027,3431,6542,6098,9895,13124,2868,2106,2520,51436,47580
"Warren, PA Micro Area",39756,178,252,643,1084,1034,2015,736,220,237,305,12615,47620
"Kingsport-Bristol, TN-VA Metro Area",306546,1901,1661,4970,8997,8225,14712,10700,1789,1901,3834,88440,28700
"Kingston, NY Metro Area",178665,1152,1370,3469,6044,5540,7654,10650,2117,1563,1903,56406,28740
"Kingsville, TX Micro Area",31542,644,502,1202,1386,1091,1443,3996,919,152,369,7584,28780
"Kinston, NC Micro Area",56756,339,347,892,1685,1583,2995,2658,461,166,146,14450,28820
"Kirksville, MO Micro Area",29924,633,594,1246,895,738,1461,5412,708,175,39,7941,28860
"Klamath Falls, OR Micro Area",66921,423,488,1099,2218,1984,3124,3629,332,200,574,20817,28900
"Knoxville, TN Metro Area",853337,7238,7206,17305,27933,25536,41224,45386,10201,6679,16132,254593,28940
"Kalamazoo-Portage, MI Metro Area",262745,3592,3402,8886,9745,8302,12442,27981,5102,2317,5113,83364,28020
"Kalispell, MT Micro Area",99899,536,830,1262,2715,3030,4643,2497,705,664,1281,31453,28060
"Kankakee, IL Metro Area",110637,1049,751,2429,3644,3169,6151,6905,818,576,665,29100,28100
"Kansas City, MO-KS Metro Area",2124518,11854,11541,40481,75372,75136,113658,82875,30629,26321,33573,661956,28140
"Kapaa, HI Micro Area",71769,476,440,871,2191,2232,2974,1917,440,413,995,17690,28180
"Kearney, NE Micro Area",55738,656,680,1406,1789,1994,2694,5328,520,321,381,16791,28260
"Keene, NH Micro Area",76042,598,911,1367,2372,2234,2942,6924,765,691,989,24444,28300
"Kendallville, IN Micro Area",47506,288,291,897,1485,1423,2928,1149,174,124,300,12936,28340
"Kennett, MO Micro Area",30027,214,170,402,771,771,1761,806,119,45,26,7303,28380
"Kennewick-Richland, WA Metro Area",289527,2051,1706,5734,10230,11011,18081,11048,2217,2147,5698,79134,28420
"Kerrville, TX Micro Area",51843,330,227,901,1385,1272,2357,1576,238,331,715,16511,28500
"Ketchikan, AK Micro Area",13800,112,90,271,524,462,666,423,143,64,148,4373,28540
"Key West, FL Micro Area",75798,514,442,1007,2428,2359,2766,2267,595,716,1567,26418,28580
"Kill Devil Hills, NC Micro Area",36222,203,162,527,920,871,1506,1255,255,278,521,13215,28620
"Killeen-Temple, TX Metro Area",444716,5212,4499,12894,20850,17740,25029,29116,5508,3283,2246,122865,28660
"Kokomo, IN Metro Area",82331,615,508,1447,2475,2318,4512,3054,301,382,1475,25311,29020
"Laconia, NH Micro Area",60887,389,501,733,1713,1519,3119,2189,892,494,990,20904,29060
"La Crosse-Onalaska, WI-MN Metro Area",136542,1575,1739,3814,4511,4207,6181,13840,1979,1205,1289,45196,29100
"Lafayette, LA Metro Area",489914,2988,3253,9284,19094,17345,26512,21610,3573,2442,4539,126743,29180
"Lafayette-West Lafayette, IN Metro Area",228541,4239,5180,10683,9107,7120,10307,34570,9090,2483,5872,67049,29200
"La Grande, OR Micro Area",26337,230,118,719,683,794,1400,1425,183,154,145,8163,29260
"LaGrange, GA-AL Micro Area",103579,697,986,2027,3532,3049,4918,4552,669,353,964,24166,29300
"Lake Charles, LA Metro Area",208549,1288,1606,3932,7947,7000,10990,9544,1459,555,2012,55656,29340
"Lake City, FL Micro Area",69968,748,600,1397,2438,2388,3200,1918,514,218,433,18164,29380
"Lake Havasu City-Kingman, AZ Metro Area",207695,952,909,3124,5872,5426,7847,5097,1145,938,1061,65412,29420
"Lakeland-Winter Haven, FL Metro Area",686218,5900,3762,11256,22997,21299,35953,28815,4990,3890,5850,172137,29460
"Lamesa, TX Micro Area",12813,97,135,525,728,602,1016,506,40,21,39,2320,29500
"Lancaster, PA Metro Area",540999,3412,3422,10279,18376,16972,25797,22011,5259,3175,5988,155065,29540
"Lansing-East Lansing, MI Metro Area",546772,7205,6607,14364,19699,16767,26545,56984,11391,6324,8116,169898,29620
"Laramie, WY Micro Area",38390,907,864,2626,2295,1355,1212,9153,2610,442,1094,14089,29660
"Laredo, TX Metro Area",273526,2746,2190,6029,9804,8827,20204,15084,1881,938,2098,44952,29700
"Las Cruces, NM Metro Area",216069,1672,3226,6805,7796,6725,12758,21017,2913,1662,3092,53950,29740
"Las Vegas, NM Micro Area",32274,176,243,785,992,880,1433,2470,502,220,237,7378,29780
"Las Vegas-Henderson-Paradise, NV Metro Area",2182004,14042,13611,40593,82901,80901,117446,97892,22847,13821,25392,619197,29820
"Laurel, MS Micro Area",84857,405,684,1566,2608,2286,4737,3227,508,295,522,17002,29860
"Laurinburg, NC Micro Area",35076,201,273,736,1203,1025,1609,1493,118,93,148,7251,29900
"Lawrence, KS Metro Area",120290,2721,2854,5186,5334,4054,4664,21131,4326,1283,1885,40778,29940
"Lawrenceburg, TN Micro Area",43390,210,267,712,1370,1139,2183,1495,163,130,310,10177,29980
"Lawton, OK Metro Area",127620,1355,1459,3981,5994,5258,6890,7139,1241,856,681,32576,30020
"Lebanon, MO Micro Area",35531,93,222,657,1065,980,1809,850,205,98,173,9249,30060
"Lebanon, NH-VT Micro Area",217064,1844,1228,4185,6391,6347,9010,11143,3644,2359,3688,72134,30100
"Lebanon, PA Metro Area",139729,1092,968,2118,4149,4096,6922,4685,1055,821,874,39783,30140
"Levelland, TX Micro Area",23064,300,29,549,894,734,1411,1418,146,91,75,5127,30220
"Lewisburg, PA Micro Area",45111,724,499,508,1572,1710,1941,4579,218,237,552,10692,30260
"Lewisburg, TN Micro Area",32965,114,209,524,1086,1035,1865,804,195,73,196,8279,30280
"Lewiston, ID-WA Metro Area",62638,349,366,1267,1883,1851,3109,2473,322,268,587,19630,30300
"Lewiston-Auburn, ME Metro Area",107602,615,670,2018,3208,3199,5032,5681,854,620,679,35713,30340
"Lewistown, PA Micro Area",46276,228,282,781,1371,1287,2089,854,195,117,90,12280,30380
"Lexington, NE Micro Area",25746,78,119,502,878,963,1539,929,196,50,11,6562,30420
"Lexington-Fayette, KY Metro Area",510647,5400,4014,13274,19045,17682,23271,38274,11079,4255,9301,158242,30460
"Liberal, KS Micro Area",22349,283,172,406,1088,810,1416,859,85,71,93,4235,30580
"Lima, OH Metro Area",103175,1108,800,2006,3756,3004,5686,5957,674,412,508,29550,30620
"Lincoln, IL Micro Area",29003,218,190,588,924,910,1616,1671,160,109,204,7669,30660
"Lincoln, NE Metro Area",330329,4317,4198,10150,12736,11579,16242,33355,7227,2607,4305,109756,30700
"Little Rock-North Little Rock-Conway, AR Metro Area",737015,5184,4981,15621,26159,24898,37297,37652,11168,6467,7236,207753,30780
"Lock Haven, PA Micro Area",38915,456,401,1051,1429,996,1680,2780,296,187,320,10804,30820
"Logan, UT-ID Metro Area",137629,1546,1897,5967,5766,4099,9653,16703,2125,971,2086,38096,30860
"Logansport, IN Micro Area",37880,339,179,759,1125,1021,2297,1261,158,60,142,9871,30900
"London, KY Micro Area",148221,1243,1134,2536,5065,4536,7383,6171,1365,413,290,33683,30940
"Longview, TX Metro Area",284796,1828,1704,6079,9626,8916,15316,11306,1307,1017,2563,67213,30980
"Longview, WA Metro Area",106778,639,682,1575,3336,3163,5544,4057,654,484,1048,32142,31020
"Los Alamos, NM Micro Area",18625,124,9,190,458,814,1158,620,495,906,2042,7083,31060
"Los Angeles-Long Beach-Anaheim, CA Metro Area",13249614,96395,93962,279993,555233,506724,704661,945575,196469,148704,291299,3571217,31080
"Louisville/Jefferson County, KY-IN Metro Area",1257088,8174,7695,22719,44631,41911,65634,53252,15207,11138,16312,367676,31140
"Lubbock, TX Metro Area",316474,3945,4864,10945,12707,10868,16649,37165,7163,1693,3091,87381,31180
"Ludington, MI Micro Area",28954,93,181,515,767,722,1355,874,215,209,302,8840,31220
"Lufkin, TX Micro Area",87322,795,271,1669,2895,2619,4953,3478,349,210,602,22077,31260
"Lumberton, NC Micro Area",132596,1198,1052,2485,4460,3728,7643,6761,915,397,298,24221,31300
"Lynchburg, VA Metro Area",261652,2924,2661,6101,8727,7256,12207,22150,4955,1820,3084,72778,31340
"Macomb, IL Micro Area",30479,779,709,895,1090,806,1218,5960,669,342,86,8568,31380
"Macon-Bibb County, GA Metro Area",229504,1587,1509,4512,7412,6706,12012,12669,3129,2006,1549,58904,31420
"Madera, CA Metro Area",155433,1206,1292,2765,5265,4776,11149,8272,725,238,792,31791,31460
"Madison, IN Micro Area",32201,292,246,545,868,929,1540,1860,236,68,363,8876,31500
"Madison, WI Metro Area",653725,6400,6275,18887,26108,24332,30149,51532,16874,11382,14164,232175,31540
"Madisonville, KY Micro Area",45331,242,237,694,1445,1302,2287,1221,476,201,234,12107,31580
"Magnolia, AR Micro Area",23776,423,315,707,626,586,1252,2407,253,77,85,4341,31620
"Malone, NY Micro Area",50477,349,488,1678,2453,1960,2180,1557,142,190,220,13011,31660
"Malvern, AR Micro Area",33597,324,102,557,1334,1341,1493,1068,140,142,96,6950,31680
"Manchester-Nashua, NH Metro Area",413035,2553,2234,9022,14623,13881,21286,19043,6174,7911,12306,137801,31700
"Manhattan, KS Metro Area",132928,3056,4081,7468,7362,5408,5073,21147,3805,1025,1440,40669,31740
"Manitowoc, WI Micro Area",79185,522,440,1222,2150,2222,4031,2554,434,424,777,25978,31820
"Mankato, MN Metro Area",100749,2248,1770,2745,3976,3375,4234,14326,1157,837,491,32268,31860
"Mansfield, OH Metro Area",121100,650,1055,2603,4380,4106,6181,4299,789,430,828,34161,31900
"Marietta, OH Micro Area",60426,438,465,1108,1808,1673,3245,2512,420,305,717,17540,31930
"Marinette, WI-MI Micro Area",63465,251,367,915,1575,1587,3061,1929,249,277,594,20609,31940
"Marion, IN Micro Area",66452,650,656,1299,1980,1470,3109,5936,492,231,363,17946,31980
"McAllen-Edinburg-Mission, TX Metro Area",855176,6822,7714,18562,30641,26801,63505,45674,6212,3203,5846,136536,32580
"McComb, MS Micro Area",39532,381,179,731,1208,981,2305,1614,142,103,144,7618,32620
"McMinnville, TN Micro Area",40702,478,213,605,1148,1174,2266,1187,145,143,242,9866,32660
"McPherson, KS Micro Area",28567,222,143,625,916,821,1471,1348,280,157,289,9541,32700
"Meadville, PA Micro Area",85665,521,729,1429,2295,2229,4071,3574,543,323,627,25065,32740
"Medford, OR Metro Area",216574,1374,1116,3552,7000,6719,9829,8605,1416,1048,1903,70947,32780
"Memphis, TN-MS-AR Metro Area",1339623,9534,8578,25993,48476,42565,75714,64108,17518,10288,14449,338176,32820
"Menomonie, WI Micro Area",44759,688,795,1509,1340,1334,1965,6909,440,331,475,13330,32860
"Merced, CA Metro Area",271382,2582,2283,5879,10808,9841,18633,20550,2071,676,1130,55194,32900
"Meridian, MS Micro Area",101992,754,842,1848,3486,3165,5310,5216,888,315,670,23706,32940
"Marion, NC Micro Area",45227,309,178,731,1517,1317,2025,1260,274,135,303,11869,32000
"Marion, OH Micro Area",65299,343,331,1539,2651,2494,3827,2595,341,137,388,17367,32020
"Marquette, MI Micro Area",66686,764,876,2091,2135,2054,2818,7047,915,527,704,21183,32100
"Marshall, MN Micro Area",25758,286,166,472,790,801,1376,1847,194,255,128,8019,32140
"Marshall, MO Micro Area",22976,251,266,389,651,650,1125,1593,180,94,152,5522,32180
"Marshalltown, IA Micro Area",39964,196,266,922,1168,1252,2110,1126,242,215,408,10861,32260
"Martin, TN Micro Area",33510,430,450,1054,1059,757,1538,4105,302,145,176,8839,32280
"Martinsville, VA Micro Area",64160,254,424,965,1699,1419,3343,2251,270,248,352,16754,32300
"Maryville, MO Micro Area",22359,702,636,849,794,585,789,4813,520,126,130,6632,32340
"Mason City, IA Micro Area",50279,293,255,891,1497,1543,2481,1973,244,204,227,16006,32380
"Mayagüez, PR Metro Area",99545,1184,1298,2728,2979,2613,4585,10959,1640,629,1065,17372,32420
"Mayfield, KY Micro Area",37248,192,280,670,1122,1008,2183,1270,148,117,246,9675,32460
"Maysville, KY Micro Area",17112,234,167,236,495,583,756,614,148,78,150,4328,32500
"McAlester, OK Micro Area",44146,271,195,757,1781,1649,2151,1400,188,83,193,11105,32540
"Mexico, MO Micro Area",25644,149,199,325,616,696,1448,724,45,29,148,6294,33020
"Miami, OK Micro Area",31454,252,195,613,939,845,1620,1431,136,95,83,7222,33060
"Miami-Fort Lauderdale-Pompano Beach, FL Metro Area",6090660,37073,37431,109680,209240,204911,299755,346468,89190,52419,126163,1678569,33100
"Michigan City-La Porte, IN Metro Area",110154,558,679,2590,4279,3960,5745,3279,592,338,893,31891,33140
"Middlesborough, KY Micro Area",26791,225,177,427,857,783,1291,698,235,34,21,5729,33180
"Midland, MI Metro Area",83355,616,518,1483,2648,2644,4405,4049,838,886,2823,26860,33220
"Midland, TX Metro Area",173816,1423,1186,3561,8055,8016,8823,7481,1991,828,3640,44341,33260
