"Milledgeville, GA Micro Area",53626,586,563,2160,2155,1721,2356,6262,296,433,223,12718,33300
"Milwaukee-Waukesha, WI Metro Area",1575223,10038,10028,30022,55600,53293,84733,80737,20995,15888,30168,485972,33340
"Minden, LA Micro Area",39242,207,199,743,1284,1155,1957,1383,213,138,126,7767,33380
"Mineral Wells, TX Micro Area",28540,175,197,473,765,862,1687,762,50,85,212,7110,33420
"Minneapolis-St. Paul-Bloomington, MN-WI Metro Area",3573609,21269,20183,68597,130517,134323,195396,177686,52815,54237,78191,1166083,33460
"Minot, ND Micro Area",77132,993,786,2572,4474,3211,3153,4610,897,314,612,25317,33500
"Missoula, MT Metro Area",117309,1203,1153,3875,5196,4309,4647,11022,2295,1007,1318,41082,33540
"Mitchell, SD Micro Area",23270,177,226,461,874,787,1237,1152,164,115,98,7597,33580
"Moberly, MO Micro Area",24878,311,215,394,987,916,1346,867,145,14,66,5878,33620
"Mobile, AL Metro Area",430655,3249,3044,7769,15182,13190,23826,19431,4009,2505,4876,105663,33660
"Modesto, CA Metro Area",543194,4239,4071,10838,20519,19380,34539,32253,3664,1825,3190,128676,33700
"Monroe, LA Metro Area",203457,1409,1361,4069,6780,6377,10822,9494,1368,1196,1556,45416,33740
"Monroe, MI Metro Area",149727,996,841,2563,4536,4093,8054,6486,1259,395,2269,46099,33780
"Montgomery, AL Metro Area",373544,2476,2291,7877,13289,12106,19710,17930,5228,4095,4101,100004,33860
"Montrose, CO Micro Area",46482,132,282,683,1086,1268,2428,1145,157,349,714,15281,33940
"Morehead City, NC Micro Area",69070,291,518,964,1709,1630,2975,2785,624,566,1099,24112,33980
"Mount Vernon, OH Micro Area",61481,571,328,1449,1672,1598,2835,4789,430,392,603,17092,34540
"Mount Vernon-Anacortes, WA Metro Area",125612,804,696,2114,4148,3963,6228,4614,667,620,1845,40026,34580
"Muncie, IN Metro Area",115020,1681,2254,3989,3567,2843,4880,16234,1836,722,452,34438,34620
"Murray, KY Micro Area",38837,462,404,1563,1232,1045,1452,6434,746,363,342,11472,34660
"Muscatine, IA Micro Area",42889,311,185,847,1337,1401,2447,1339,305,90,618,12039,34700
"Muskegon, MI Metro Area",173297,844,1240,3407,6022,5627,9150,6723,924,1032,1675,46897,34740
"Muskogee, OK Micro Area",68736,476,404,1451,2191,2100,3523,3063,446,275,282,16581,34780
"Myrtle Beach-Conway-North Myrtle Beach, SC-NC Metro Area",463987,2676,2562,5884,13131,12068,19003,19011,2666,3349,4865,145327,34820
"Nacogdoches, TX Micro Area",65339,940,976,2136,2087,1701,3298,10025,661,366,280,16787,34860
"Napa, CA Metro Area",139623,1028,923,2525,4335,4504,7452,8287,1446,919,2072,41658,34900
"Naples-Marco Island, FL Metro Area",371453,1861,1554,6034,9408,9252,15477,11689,2676,3079,8367,116431,34940
"Nashville-Davidson--Murfreesboro--Franklin, TN Metro Area",1871903,12010,12764,38044,71662,68131,97360,90347,26585,19466,26469,566523,34980
"Morgan City, LA Micro Area",50968,344,238,993,1883,1420,2616,1419,247,178,193,11674,34020
"Morgantown, WV Metro Area",139157,2713,2512,4647,6569,5574,5067,18695,5044,1229,2743,41189,34060
"Morristown, TN Metro Area",140912,1102,824,2563,3997,3710,7375,5670,653,481,1055,35094,34100
"Moscow, ID Micro Area",39505,802,1090,1811,1839,1158,1638,7751,1916,421,560,13529,34140
"Moses Lake, WA Micro Area",95502,806,742,1978,3561,3129,6343,3291,369,210,714,22355,34180
"Moultrie, GA Micro Area",45486,187,320,1071,1479,1427,2758,1340,232,54,41,9090,34220
"Mountain Home, AR Micro Area",41427,177,116,549,979,950,1775,1387,164,218,172,13437,34260
"Mountain Home, ID Micro Area",26743,209,322,1183,1300,1180,1306,1412,125,119,214,8336,34300
"Mount Airy, NC Micro Area",71971,454,302,1307,2133,1781,3661,2383,401,319,315,19540,34340
"Mount Gay-Shamrock, WV Micro Area",33154,133,180,590,1076,908,1539,766,170,31,13,9203,34350
"Mount Pleasant, MI Micro Area",70688,1608,2004,2703,2786,1870,2673,16430,1672,620,391,19327,34380
"Mount Pleasant, TX Micro Area",45518,399,414,693,1373,1338,2883,1665,208,123,195,8980,34420
"Mount Sterling, KY Micro Area",46682,283,256,801,1514,1293,2477,1343,357,70,259,11260,34460
"Mount Vernon, IL Micro Area",37985,241,211,831,1323,1258,1800,1278,270,121,276,10140,34500
"Natchez, MS-LA Micro Area",51044,278,447,1112,1996,1779,2644,1933,265,153,134,10626,35020
"Natchitoches, LA Micro Area",38769,701,467,1009,1152,993,2024,4913,187,160,71,8490,35060
"New Bern, NC Metro Area",124786,1474,1286,4269,4843,3490,5398,5978,975,675,1632,37590,35100
"Newberry, SC Micro Area",38194,430,501,515,1022,961,2023,1988,222,178,328,8972,35140
"New Castle, IN Micro Area",48255,294,237,1239,1879,1558,2625,1465,130,230,325,12898,35220
"New Castle, PA Micro Area",86727,555,683,1390,2493,2254,4103,3436,484,515,570,26157,35260
"New Haven-Milford, CT Metro Area",857513,5940,6294,17717,29399,27526,46273,52690,16479,9081,13746,255998,35300
"New Orleans-Metairie, LA Metro Area",1267777,8649,6872,22165,45686,46001,62986,61167,18430,8467,18347,345741,35380
"New Philadelphia-Dover, OH Micro Area",92335,535,652,1502,2635,2692,4554,2302,766,287,988,24885,35420
"Newport, OR Micro Area",48547,115,183,716,1179,1167,1832,1093,304,277,602,16496,35440
"Newport, TN Micro Area",35552,161,157,585,1014,821,1764,757,14,95,202,7247,35460
"New Ulm, MN Micro Area",25163,179,162,465,647,829,1237,1519,96,100,97,8180,35580
"New York-Newark-Jersey City, NY-NJ-PA Metro Area",19294236,119458,117831,374781,723562,691297,970794,1040904,308054,306968,375945,5612653,35620
"Niles, MI Metro Area",154133,1054,771,2852,4716,4284,8214,6505,2139,968,2732,46510,35660
"Nogales, AZ Micro Area",46480,284,196,1063,1352,1159,3469,1694,222,65,842,10422,35700
"Norfolk, NE Micro Area",48181,299,380,824,1560,1541,2657,2202,427,152,262,14712,35740
"North Platte, NE Micro Area",36585,152,178,572,1091,1104,1977,1167,208,103,209,10845,35820
"North Port-Sarasota-Bradenton, FL Metro Area",803709,3955,3185,11204,19613,18216,31620,25992,5262,6295,14911,268392,35840
"North Vernon, IN Micro Area",27710,296,172,422,883,722,1669,1207,206,117,118,7367,35860
"Warrensburg, MO Micro Area",53682,878,1058,2462,2588,1750,2212,7343,904,253,488,16226,47660
"Warsaw, IN Micro Area",79035,580,579,1449,2628,2653,4224,2718,557,461,1348,23321,47700
"Washington, IN Micro Area",33120,263,296,475,1112,1084,1398,545,60,106,132,6534,47780
"Washington, NC Micro Area",47168,400,412,480,1084,1106,2568,1594,154,357,403,13173,47820
"Washington-Arlington-Alexandria, DC-VA-MD-WV Metro Area",6196585,38324,35813,120279,226188,234143,324948,343199,134762,170165,192314,1939042,47900
"Washington Court House, OH Micro Area",28620,105,169,570,904,745,1534,618,188,201,135,7886,47920
"North Wilkesboro, NC Micro Area",68469,629,354,912,1898,1848,3365,2149,199,341,254,19765,35900
"Norwalk, OH Micro Area",58339,438,287,1120,1730,1722,3260,1630,218,152,439,16859,35940
"Norwich-New London, CT Metro Area",267390,2305,2455,6846,9913,8594,13848,13279,3466,2670,7527,86861,35980
"Oneonta, NY Micro Area",59972,838,885,1401,1500,1472,2684,6759,528,495,358,17732,36580
"Ontario, OR-ID Micro Area",53672,363,469,1129,1933,1828,2801,1743,122,161,363,13036,36620
"Waterloo-Cedar Falls, IA Metro Area",169556,1807,1783,4985,5807,5161,7610,16452,2328,836,2041,52144,47940
"Watertown, SD Micro Area",34051,203,129,699,1213,1056,1780,1510,161,100,210,10892,47980
"Watertown-Fort Atkinson, WI Micro Area",84701,656,428,1583,2394,2498,4277,4830,593,496,861,25981,48020
"Watertown-Fort Drum, NY Metro Area",112842,1416,1581,4181,6231,4683,5325,4743,973,582,852,33102,48060
"Wauchula, FL Micro Area",27131,163,251,710,1206,924,1511,840,63,31,34,4407,48100
"Wausau-Weston, WI Metro Area",163140,948,1048,2708,4790,4803,8284,6342,833,1022,1373,52823,48140
"Waycross, GA Micro Area",54843,335,277,912,2204,1622,2856,1418,246,49,227,12368,48180
"Weatherford, OK Micro Area",29152,449,413,1032,989,951,1507,3294,370,141,100,7609,48220
"Weirton-Steubenville, WV-OH Metro Area",118213,880,714,2007,3311,2867,5067,5829,853,438,514,34023,48260
"Wenatchee, WA Metro Area",118252,971,772,1963,3870,3706,7028,4215,601,544,1092,34186,48300
"West Plains, MO Micro Area",40104,234,281,725,1173,1127,2189,1440,489,232,205,10816,48460
"West Point, MS Micro Area",19640,177,97,271,638,576,1309,1017,73,58,71,4220,48500
"Wheeling, WV-OH Metro Area",141475,920,990,2344,4793,4297,6912,5557,1123,456,1040,38231,48540
"Whitewater, WI Micro Area",103074,1216,1360,2230,2889,2810,5449,9047,868,571,1010,33096,48580
"Wichita, KS Metro Area",637690,4487,4517,13314,22553,21414,37919,32841,8227,4967,11030,185806,48620
"Wichita Falls, TX Metro Area",150715,2032,1338,4206,6134,5543,6721,8606,1513,912,1205,39037,48660
"Williamsport, PA Metro Area",114330,961,924,1819,4102,3513,5210,6509,650,571,937,33460,48700
"Williston, ND Micro Area",35208,133,198,954,1981,2344,1822,1206,66,169,222,11231,48780
"Willmar, MN Micro Area",42841,288,349,884,1370,1361,2302,1272,304,174,276,12643,48820
"Wilmington, NC Metro Area",288337,2401,2558,6998,9432,8863,12663,22486,3146,2760,4783,96361,48900
"Wilmington, OH Micro Area",41957,417,302,650,1226,1171,2307,1838,215,200,346,11595,48940
"Wilson, NC Micro Area",81435,600,267,1501,2506,2211,4707,3860,672,393,627,20704,48980
"Winchester, VA-WV Metro Area",137621,474,864,2756,4128,3902,7213,5021,1669,1146,1395,39399,49020
"Winfield, KS Micro Area",35351,386,264,670,1100,1074,1907,2054,226,189,205,9683,49060
"Winnemucca, NV Micro Area",16828,96,62,222,531,858,995,565,105,61,157,4886,49080
"Winona, MN Micro Area",50725,734,720,1919,1854,1377,2178,8212,311,440,592,15753,49100
"Winston-Salem, NC Metro Area",666216,4057,3448,12428,20120,18881,36323,31313,6594,5578,6473,196138,49180
"Wisconsin Rapids-Marshfield, WI Micro Area",73112,325,337,1244,2012,2213,3526,2226,368,482,400,24340,49220
"Woodward, OK Micro Area",24742,86,184,527,865,999,1377,498,66,104,130,6125,49260
"Wooster, OH Micro Area",116099,1307,786,1951,3560,3305,5388,5720,1067,518,1139,32399,49300
"Worcester, MA-CT Metro Area",941338,7200,6587,18967,30981,30100,50772,59126,14360,12543,20932,284824,49340
"Worthington, MN Micro Area",21734,188,107,363,841,759,1085,480,131,47,53,5577,49380
"Yakima, WA Metro Area",249697,1824,1695,5287,8896,7877,16215,8810,1788,561,909,56507,49420
"Yankton, SD Micro Area",22717,176,189,390,754,764,1219,723,262,106,216,7128,49460
"Yauco, PR Metro Area",90618,759,536,1848,2548,2443,4868,5963,617,418,328,11815,49500
"York-Hanover, PA Metro Area",445565,2593,2769,7816,13996,13670,22683,17450,3958,3174,5590,132289,49620
"Youngstown-Warren-Boardman, OH-PA Metro Area",541846,3596,3587,10016,16639,14886,27736,22405,3867,3116,5203,162987,49660
"Yuba City, CA Metro Area",172469,1008,1226,4027,6888,6180,9918,10340,1521,645,1272,43773,49700
"Yuma, AZ Metro Area",209468,1783,2458,6311,8573,7563,12625,10816,1186,528,1406,49320,49740
"Zanesville, OH Micro Area",86131,722,686,1462,2643,2336,4398,3788,519,152,476,23746,49780
"Zapata, TX Micro Area",14304,48,50,438,475,398,894,190,5,0,79,2023,49820
"Opelousas, LA Micro Area",83172,737,469,1311,2636,2459,4561,1813,312,152,265,16630,36660
"Orangeburg, SC Micro Area",87687,822,490,1687,2647,2196,4795,5727,1360,321,490,20565,36700
"Orlando-Kissimmee-Sanford, FL Metro Area",2508970,17508,17171,51618,100895,91696,129297,162073,34194,26419,46617,727672,36740
"Fort Dodge, IA Micro Area",36545,315,484,879,1395,1134,1796,2083,156,140,274,10573,22700
"Fort Collins, CO Metro Area",344786,3738,3824,11315,14350,12004,15715,33676,6924,5666,10588,122703,22660
